[03/10/21, 11:22:23] Pranav Cr: â€Messages and calls are end-to-end encrypted. No one outside of this chat, not even WhatsApp, can read or listen to them.
[03/10/21, 11:22:23] Kavana N Murthy: So no batches?
[03/10/21, 11:22:34] Pranav Cr: Nope no batches..
[03/10/21, 11:22:44] Kavana N Murthy: Oh okay thank youğŸ˜„
[03/10/21, 11:22:58] Pranav Cr: No probs:)
[04/10/21, 19:06:43] Kavana N Murthy: Do we have oops lab Tomo??
[04/10/21, 19:07:06] Pranav Cr: Yupp we do..
[04/10/21, 19:48:09] Kavana N Murthy: Okiess
[15/10/21, 17:14:57] Kavana N Murthy: Can it be tonight not 7.30?
[15/10/21, 17:15:20] Pranav Cr: It's not tonight.. it'll be tomorrow night
[15/10/21, 17:15:27] Kavana N Murthy: Oh okiess than you
[15/10/21, 17:15:33] Kavana N Murthy: Thank*
[15/10/21, 17:15:37] Pranav Cr: Cool np!
[20/10/21, 12:34:34] Kavana N Murthy: Do we have
[20/10/21, 12:34:39] Kavana N Murthy: Wad lab Tomo?
[20/10/21, 12:34:56] Pranav Cr: nope no WAD lab tomorrow
[20/10/21, 12:35:01] Kavana N Murthy: Okies thank you
[20/10/21, 12:35:15] Pranav Cr: ğŸ‘ğŸ‘
[29/10/21, 15:51:36] Kavana N Murthy: U have this code?
[29/10/21, 15:51:39] Kavana N Murthy: U sent the pic no
[29/10/21, 15:53:34] Pranav Cr: Yea open it in your laptop with notepad it'll come
[29/10/21, 15:53:47] Kavana N Murthy: Oh okiess I'll try
[29/10/21, 15:53:56] Pranav Cr: ğŸ‘
[30/10/21, 18:15:20] Kavana N Murthy: Did u  do all of them?
[30/10/21, 18:16:12] Pranav Cr: no actually, im unable to do que 2
[30/10/21, 18:16:15] Pranav Cr: some error
[30/10/21, 18:16:41] Kavana N Murthy: The first one?
[30/10/21, 18:17:09] Pranav Cr: the first one i did in lab that time and i sent it in d grp no..
[30/10/21, 18:17:14] Pranav Cr: oh wait that was for 3rd one
[30/10/21, 18:17:20] Kavana N Murthy: Yep that was the third one
[30/10/21, 18:17:37] Pranav Cr: ah then ill have to do 1st one as well
[30/10/21, 18:17:54] Kavana N Murthy: I'm not able to see the data only
[30/10/21, 18:17:57] Kavana N Murthy: In that thing
[30/10/21, 18:18:00] Kavana N Murthy: It's so blurry
[30/10/21, 18:18:16] Pranav Cr: u can put any junk data in the cells it doesnt matter tbh
[30/10/21, 18:18:35] Kavana N Murthy: Oh Okay then fine
[30/10/21, 18:19:38] Pranav Cr: yeağŸ‘
[30/10/21, 18:20:47] Kavana N Murthy: Thanks4
[30/10/21, 18:21:02] Pranav Cr: cool np:)
â€[06/11/21, 14:15:04] Kavana N Murthy: â€<attached: 00000040-PHOTO-2021-11-06-14-15-04.jpg>
[06/11/21, 14:15:12] Kavana N Murthy: Could u do the second one and third one with steps
[06/11/21, 14:15:20] Kavana N Murthy: I didn't understand em
[06/11/21, 14:15:44] Kavana N Murthy: Minterm means output should be 1 no?
[06/11/21, 14:15:53] Pranav Cr: Yea cool I'll send by the evening? I'm outside so..
[06/11/21, 14:15:54] Pranav Cr: Yepp
[06/11/21, 14:16:01] Kavana N Murthy: Haan okies np
[06/11/21, 14:16:06] Kavana N Murthy: Acha okies
[06/11/21, 14:16:14] Pranav Cr: â€This message was deleted.
[06/11/21, 14:16:19] Pranav Cr: ğŸ‘ğŸ‘
â€[07/11/21, 11:24:46] Pranav Cr: â€<attached: 00000050-PHOTO-2021-11-07-11-24-46.jpg>
â€[07/11/21, 11:24:55] Pranav Cr: â€<attached: 00000051-PHOTO-2021-11-07-11-24-55.jpg>
[07/11/21, 11:24:58] Pranav Cr: Sorry for the delay
[07/11/21, 11:25:15] Kavana N Murthy: It's okay thanks a lotğŸ˜
[07/11/21, 11:25:25] Pranav Cr: Np:)!
[07/11/21, 11:25:39] Kavana N Murthy: When are we supposed to submit this?
[07/11/21, 11:25:49] Pranav Cr: Next offline dld class
[07/11/21, 11:25:59] Kavana N Murthy: That's Thursday no
[07/11/21, 11:26:13] Pranav Cr: Yeah mam told it's offline submission so
[07/11/21, 11:28:39] Kavana N Murthy: Oh okay
[07/11/21, 11:28:48] Kavana N Murthy: Do u have bookmart pdf of ops
[07/11/21, 11:28:52] Kavana N Murthy: Or Math?
[07/11/21, 11:28:59] Kavana N Murthy: In the drive I could find only coa
[07/11/21, 11:29:03] Pranav Cr: Bookmart notes?
[07/11/21, 11:29:05] Kavana N Murthy: Yes
[07/11/21, 11:29:26] Pranav Cr: No actually..but if you want I'll ask and get it?
[07/11/21, 11:29:34] Kavana N Murthy: Yeah that would be cool
[07/11/21, 11:29:36] Pranav Cr: Could you send the coa notes?
[07/11/21, 11:29:42] Kavana N Murthy: If u get it just just let me know
[07/11/21, 11:29:48] Kavana N Murthy: One sec
[07/11/21, 11:29:50] Pranav Cr: Yeah cool
â€[07/11/21, 11:30:06] Kavana N Murthy: LD(bookmart notes).pdf â€¢ â€136 pages â€<attached: 00000072-LD(bookmart notes).pdf>
[07/11/21, 11:30:12] Kavana N Murthy: There is dld too
[07/11/21, 11:30:24] Pranav Cr: Ah okayy thanks a lot:)!
[07/11/21, 11:30:36] Kavana N Murthy: NpppğŸ˜„
[07/11/21, 11:31:42] Pranav Cr: https://drive.google.com/drive/folders/1Ot3gCYh7Cdmd15Uz6KefgsaeFYxxuOGn?usp=sharing
[07/11/21, 11:31:52] Pranav Cr: In this cs notes are there check if they match..
[07/11/21, 11:32:09] Kavana N Murthy: Haan one sec
[07/11/21, 11:35:08] Kavana N Murthy: Math is full scattered should check bookmart only ig
[07/11/21, 11:35:35] Pranav Cr: Ohh okay I'll ask some of my other friends if they have it by chance
[07/11/21, 11:35:54] Kavana N Murthy: Haan okies
â€[07/11/21, 16:13:40] Kavana N Murthy: â€<attached: 00000082-PHOTO-2021-11-07-16-13-40.jpg>
[07/11/21, 16:13:46] Kavana N Murthy: How do u do the 6th one?
[07/11/21, 16:20:47] Pranav Cr: I'll send one example
â€[07/11/21, 16:20:58] Pranav Cr: â€<attached: 00000085-PHOTO-2021-11-07-16-20-58.jpg>
â€[07/11/21, 16:20:59] Pranav Cr: â€<attached: 00000086-PHOTO-2021-11-07-16-20-59.jpg>
[07/11/21, 16:21:32] Kavana N Murthy: Oh okay like this got it thank you
[07/11/21, 16:22:32] Pranav Cr: No probs!
[08/11/21, 08:11:15] Kavana N Murthy: Where is the DSC lab today?
[08/11/21, 08:13:58] Pranav Cr: CCP lab pg block 6th floor
[08/11/21, 08:40:25] Kavana N Murthy: Okies thank you
[14/11/21, 01:27:53] Kavana N Murthy: â€You deleted this message.
[14/11/21, 01:28:04] Kavana N Murthy: â€You deleted this message.
â€[14/11/21, 01:50:12] Kavana N Murthy: â€<attached: 00000094-PHOTO-2021-11-14-01-50-12.jpg>
[14/11/21, 01:50:20] Kavana N Murthy: Could u solve 3c
[14/11/21, 08:15:02] Pranav Cr: Yup I'll solve and send by 12?
[14/11/21, 08:29:02] Kavana N Murthy: Yep sure
[14/11/21, 08:29:04] Kavana N Murthy: Thank you
â€[14/11/21, 12:18:52] Pranav Cr: â€<attached: 00000099-PHOTO-2021-11-14-12-18-52.jpg>
[14/11/21, 12:19:05] Pranav Cr: I think this is correct not sure thoğŸ˜.. verify once
[14/11/21, 12:24:11] Pranav Cr: last one is doubtful coz idk what < symbol does
[14/11/21, 12:49:41] Kavana N Murthy: Oh okies I'll check it out
[14/11/21, 12:56:08] Pranav Cr: ğŸ‘
â€[15/11/21, 17:08:43] Kavana N Murthy: â€<attached: 00000104-PHOTO-2021-11-15-17-08-43.jpg>
[15/11/21, 17:08:50] Kavana N Murthy: Do uk how to do this?
[15/11/21, 17:14:28] Pranav Cr: Yea! It's there in the scheme also
[15/11/21, 17:16:23] Kavana N Murthy: Could u send me
[15/11/21, 17:17:05] Pranav Cr: https://drive.google.com/folderview?id=1xmc9opscR8d5iRCBFb5OEpqUbsMH8qiB
[15/11/21, 17:17:10] Pranav Cr: Schemes are in this folder
[15/11/21, 17:17:36] Kavana N Murthy: Thanks a lot
[15/11/21, 17:18:06] Pranav Cr: ğŸ‘
[15/11/21, 17:19:19] Kavana N Murthy: U have it for all the subjects?
[15/11/21, 17:19:35] Pranav Cr: Only some subjects have schemes
[15/11/21, 17:19:45] Pranav Cr: It's there in the subject folder as schemes
[15/11/21, 17:19:58] Kavana N Murthy: Could u send me which all the drives are like mixed up
[15/11/21, 17:20:18] Pranav Cr: Yea one sec
[15/11/21, 17:20:43] Pranav Cr: https://drive.google.com/folderview?id=134NixYJTI28oKyX6xFfpIoF97S87igw4
[15/11/21, 17:21:12] Kavana N Murthy: Thank you
[15/11/21, 17:30:06] Pranav Cr: ğŸ‘
[15/11/21, 18:09:43] Kavana N Murthy: Could u Send Ur oops observations
[15/11/21, 18:10:00] Pranav Cr: Yea one sec
â€[15/11/21, 18:11:08] Pranav Cr: â€<attached: 00000122-PHOTO-2021-11-15-18-11-08.jpg>
â€[15/11/21, 18:11:15] Pranav Cr: â€<attached: 00000123-PHOTO-2021-11-15-18-11-15.jpg>
â€[15/11/21, 18:11:27] Pranav Cr: â€<attached: 00000124-PHOTO-2021-11-15-18-11-27.jpg>
â€[15/11/21, 18:11:33] Pranav Cr: â€<attached: 00000125-PHOTO-2021-11-15-18-11-33.jpg>
â€[15/11/21, 18:11:40] Pranav Cr: â€<attached: 00000126-PHOTO-2021-11-15-18-11-40.jpg>
â€[15/11/21, 18:11:48] Pranav Cr: â€<attached: 00000127-PHOTO-2021-11-15-18-11-48.jpg>
â€[15/11/21, 18:11:58] Pranav Cr: â€<attached: 00000128-PHOTO-2021-11-15-18-11-58.jpg>
â€[15/11/21, 18:12:05] Pranav Cr: â€<attached: 00000129-PHOTO-2021-11-15-18-12-05.jpg>
â€[15/11/21, 18:12:14] Pranav Cr: â€<attached: 00000130-PHOTO-2021-11-15-18-12-14.jpg>
[15/11/21, 18:12:22] Pranav Cr: Last week pgms I haven't written yet..
[15/11/21, 18:12:33] Kavana N Murthy: Oh okay thank you
[15/11/21, 18:12:41] Pranav Cr: ğŸ‘
[15/11/21, 18:12:41] Kavana N Murthy: When u write could u send me
[15/11/21, 18:12:52] Pranav Cr: Yea I'll send by 9 it's fine?
[15/11/21, 18:13:01] Kavana N Murthy: Yes yes it's fine
[15/11/21, 18:13:11] Pranav Cr: ğŸ‘ğŸ‘
â€[15/11/21, 22:31:26] Pranav Cr: â€<attached: 00000138-PHOTO-2021-11-15-22-31-26.jpg>
â€[15/11/21, 22:31:32] Pranav Cr: â€<attached: 00000139-PHOTO-2021-11-15-22-31-32.jpg>
â€[15/11/21, 22:31:38] Pranav Cr: â€<attached: 00000140-PHOTO-2021-11-15-22-31-38.jpg>
â€[15/11/21, 22:31:44] Pranav Cr: â€<attached: 00000141-PHOTO-2021-11-15-22-31-44.jpg>
[15/11/21, 22:31:54] Pranav Cr: One code i haven't written since I had a doubt
[15/11/21, 22:53:37] Kavana N Murthy: Haan okies thank you
[16/11/21, 00:17:39] Kavana N Murthy: 1.program to print allernate nodes
2.merge 2SLL
3.Given 2SLL. Generate 3rd one which has common elements of both.
4. Given SLL. Split it into 2. One having even no and other one odd
[16/11/21, 00:17:39] Kavana N Murthy: U have these codes?
[16/11/21, 08:03:03] Pranav Cr: Yep except the 3rd one
[16/11/21, 12:56:09] Kavana N Murthy: No need to go no
[16/11/21, 12:56:16] Kavana N Murthy: She will cancel
[16/11/21, 12:56:20] Kavana N Murthy: If only 1/2 go no
[16/11/21, 12:56:44] Pranav Cr: Yea but these ppl are planning (4-5)
[16/11/21, 12:56:57] Kavana N Murthy: Let them go it's okay 53/4
[16/11/21, 12:57:00] Kavana N Murthy: She won't take
[16/11/21, 12:57:15] Pranav Cr: Yea then it's decided
[16/11/21, 12:57:32] Kavana N Murthy: Then no need to go
[16/11/21, 12:58:18] Pranav Cr: Yupp
[16/11/21, 13:28:04] Kavana N Murthy: So pakka no then no?
[16/11/21, 13:44:47] Pranav Cr: Yepp not
[16/11/21, 13:44:50] Pranav Cr: No lab
[16/11/21, 13:46:30] Kavana N Murthy: Okies
â€[17/11/21, 17:19:33] Kavana N Murthy: â€<attached: 00000160-PHOTO-2021-11-17-17-19-32.jpg>
[17/11/21, 17:19:37] Kavana N Murthy: Could u doo this
[17/11/21, 17:20:01] Pranav Cr: What's the complete question?
[17/11/21, 17:20:19] Kavana N Murthy: One sec
â€[17/11/21, 17:20:39] Kavana N Murthy: â€<attached: 00000164-PHOTO-2021-11-17-17-20-39.jpg>
[17/11/21, 17:21:08] Pranav Cr: Yea wait someone sent the ans to me
[17/11/21, 17:21:12] Kavana N Murthy: Haan okies
â€[17/11/21, 17:21:22] Pranav Cr: â€<attached: 00000167-PHOTO-2021-11-17-17-21-22.jpg>
â€[17/11/21, 17:21:23] Pranav Cr: â€<attached: 00000168-PHOTO-2021-11-17-17-21-23.jpg>
[17/11/21, 17:21:32] Pranav Cr: Check if this is right.. I'm not sure..
[17/11/21, 17:22:48] Kavana N Murthy: Okies I'll try it
[17/11/21, 17:32:29] Kavana N Murthy: Haan it's correct
[17/11/21, 17:32:56] Pranav Cr: okayyğŸ‘
[17/11/21, 17:54:01] Kavana N Murthy: Using Quine-McCluskey method, obtain all the prime implicates and essential
prime implicates for the following boolean function.
f(a,b,c,d)= Ï€M(1,5,6,7,9,11,12,13) + dc(0,3,4)
[17/11/21, 17:54:08] Kavana N Murthy: Do uk how to do this?
[17/11/21, 17:55:40] Pranav Cr: Yeah shall I solve and send?
[17/11/21, 17:55:55] Kavana N Murthy: Yes that would be helpful
â€[17/11/21, 19:34:14] Pranav Cr: â€<attached: 00000177-PHOTO-2021-11-17-19-34-14.jpg>
â€[17/11/21, 19:34:23] Pranav Cr: â€<attached: 00000178-PHOTO-2021-11-17-19-34-23.jpg>
[17/11/21, 19:34:32] Pranav Cr: Take complement of the ans, that's the soln
[17/11/21, 19:37:43] Kavana N Murthy: Oh okiess thank you
[17/11/21, 19:37:57] Pranav Cr: ğŸ‘ğŸ‘
[19/11/21, 19:42:08] Kavana N Murthy: Identify the commands that help the assembler in translating source program into an
object program with an example.
â€[19/11/21, 19:42:35] Pranav Cr: â€<attached: 00000183-PHOTO-2021-11-19-19-42-35.jpg>
â€[19/11/21, 19:42:42] Pranav Cr: â€<attached: 00000184-PHOTO-2021-11-19-19-42-42.jpg>
[19/11/21, 19:43:25] Kavana N Murthy: thank you
[19/11/21, 20:41:28] Pranav Cr: ğŸ‘
â€[19/11/21, 21:45:27] Kavana N Murthy: â€<attached: 00000187-PHOTO-2021-11-19-21-45-27.jpg>
[19/11/21, 21:45:39] Kavana N Murthy: 2c is register addressing mode no
[19/11/21, 21:46:34] Pranav Cr: no no it is  two address instruction
[19/11/21, 21:46:42] Kavana N Murthy: Oh okay
[19/11/21, 21:46:51] Kavana N Murthy: Oh that two pass assembler thing?
[19/11/21, 21:47:03] Kavana N Murthy: How do to 3A
[19/11/21, 21:47:25] Pranav Cr: ill solve and send in 15 mins
[19/11/21, 21:47:30] Kavana N Murthy: Yeah sure
â€[19/11/21, 21:53:49] Pranav Cr: â€<attached: 00000195-PHOTO-2021-11-19-21-53-49.jpg>
[19/11/21, 21:55:27] Kavana N Murthy: Thank you so if it's a bigger expression we keep on doing it for R4 and all no?
[19/11/21, 21:55:58] Pranav Cr: yea thats all
[19/11/21, 21:56:06] Kavana N Murthy: Haan okies
[19/11/21, 21:56:16] Kavana N Murthy: Second subdivision how
[19/11/21, 21:56:48] Pranav Cr: its there in notes
[19/11/21, 21:57:11] Pranav Cr: https://drive.google.com/file/d/1eWDFy3NLaxR__ybGB34wk8cOENSCxNZS/view
[19/11/21, 21:57:18] Kavana N Murthy: Oh okay
[19/11/21, 21:57:23] Pranav Cr: page 9
[19/11/21, 21:57:31] Kavana N Murthy: So we just change the number
[19/11/21, 21:57:33] Kavana N Murthy: Right
[19/11/21, 21:57:37] Kavana N Murthy: If it's 4 or 6
[19/11/21, 21:57:43] Pranav Cr: yea exactly
[19/11/21, 21:58:03] Kavana N Murthy: Haan okies thank you
[19/11/21, 21:58:12] Pranav Cr: ğŸ‘ğŸ‘
[19/11/21, 21:58:34] Kavana N Murthy: And that reason why it's too large to sit in word length
[19/11/21, 21:58:38] Kavana N Murthy: What do we write
[19/11/21, 21:59:01] Pranav Cr: you have to write full.. 5 marks que
[19/11/21, 21:59:14] Kavana N Murthy: It's there in any pdf?
[19/11/21, 21:59:38] Pranav Cr: nope only the classrom notes
[19/11/21, 21:59:50] Kavana N Murthy: Oh okay fine
[19/11/21, 22:08:11] Pranav Cr: It's 3 and 5
[19/11/21, 22:08:18] Pranav Cr: It starts from 0
[19/11/21, 22:08:41] Kavana N Murthy: could u  write this
[19/11/21, 22:09:19] Pranav Cr: One sec
â€[19/11/21, 22:11:05] Pranav Cr: â€<attached: 00000220-PHOTO-2021-11-19-22-11-05.jpg>
[19/11/21, 22:12:14] Kavana N Murthy: thank you
[19/11/21, 22:12:31] Pranav Cr: ğŸ‘
[21/11/21, 12:21:32] Kavana N Murthy: Oops lab did she mark us absent that day
[21/11/21, 12:21:37] Kavana N Murthy: Or she cancelled the class?
[21/11/21, 12:22:01] Pranav Cr: I'm not sure . I think she cancelled the class since all were absent
[21/11/21, 14:20:44] Kavana N Murthy: Oh okay then fine
[22/11/21, 23:34:53] Kavana N Murthy: U did dsc record?
[23/11/21, 06:50:05] Pranav Cr: Today I'll finish it ..
[23/11/21, 17:34:20] Kavana N Murthy: Oh okay
[23/11/21, 17:34:24] Kavana N Murthy: Tell me which all are there?
[23/11/21, 18:02:59] Pranav Cr: Add end delete beginning
[23/11/21, 18:03:10] Pranav Cr: Insert value to a sorted SLL
[23/11/21, 18:03:34] Pranav Cr: Implement stack using arrays
[23/11/21, 18:03:44] Pranav Cr: Convert infix to postfix
[23/11/21, 18:06:17] Kavana N Murthy: Then
[23/11/21, 18:06:55] Pranav Cr: I think that's all
[23/11/21, 18:07:09] Kavana N Murthy: She told 7 no
[23/11/21, 18:07:13] Pranav Cr: 7 ah
[23/11/21, 18:07:15] Kavana N Murthy: What all did u write
[23/11/21, 18:07:17] Kavana N Murthy: Hu
[23/11/21, 18:07:20] Pranav Cr: Lab programs only she asked to write
[23/11/21, 18:07:33] Pranav Cr: Rest all are manipulation programs
[23/11/21, 18:07:39] Kavana N Murthy: Oh okay
[23/11/21, 18:08:28] Pranav Cr: Wait I have asked her
[23/11/21, 18:08:33] Pranav Cr: Let's see what she replies
[23/11/21, 18:09:25] Kavana N Murthy: Haan okay
[23/11/21, 18:09:33] Pranav Cr: She replied
[23/11/21, 18:09:35] Pranav Cr: Yrs
[23/11/21, 18:09:39] Pranav Cr: What does this mean nowğŸ¥²
[23/11/21, 18:09:47] Kavana N Murthy: WhatğŸ˜‚
[23/11/21, 18:09:50] Kavana N Murthy: Is that
[23/11/21, 18:10:01] Pranav Cr: ğŸ¥²ğŸ¥²ğŸ¥²these ppl can't say anything properly
[23/11/21, 18:10:06] Kavana N Murthy: Exactly
[23/11/21, 18:10:33] Pranav Cr: All half and half ğŸ˜¶ğŸ¤¦â€â™‚ï¸. I'll ask Mamatha mam only
[23/11/21, 18:10:52] Kavana N Murthy: Mad only she told 7 I remember
[23/11/21, 18:12:09] Pranav Cr: Wait I'll ask shubha mamğŸ¤¦â€â™‚ï¸
[23/11/21, 18:12:56] Kavana N Murthy: Huu ask
[23/11/21, 18:13:08] Pranav Cr: What and all I have to do cheyğŸ¥²
[23/11/21, 18:13:17] Pranav Cr: This harini mam isğŸ˜¶
[23/11/21, 18:13:25] Kavana N Murthy: Srslyyy she is very annoying
[23/11/21, 18:13:52] Pranav Cr: Such teachers only will be lab teachersğŸ˜‚
[23/11/21, 18:20:30] Pranav Cr: Hello mam, reconfirming the lab programs
1. Add end, delete beginning
2. Insert into sorted SLL
3. Stack operations using arrays
4. Infix to postfix
Any other program mam?
[23/11/21, 18:20:31] Pranav Cr: These are the programs for know
[23/11/21, 18:20:41] Pranav Cr: Only 4 then
[23/11/21, 18:22:41] Kavana N Murthy: TrueğŸ˜‚
[23/11/21, 18:22:50] Kavana N Murthy: Oh okay
[23/11/21, 18:22:57] Kavana N Murthy: So this should be that menu driven way only?
[23/11/21, 18:23:03] Pranav Cr: Yepp menu driven
[23/11/21, 18:23:14] Kavana N Murthy: Okies done then
[23/11/21, 19:06:30] Kavana N Murthy: Do we have classes during phase shift ?
[23/11/21, 19:06:53] Pranav Cr: nope no classes
[23/11/21, 19:07:02] Kavana N Murthy: So 26 and 27 no classes?
[23/11/21, 19:07:10] Pranav Cr: 95 % no
[23/11/21, 19:07:14] Kavana N Murthy: Oh okiess
[25/11/21, 17:32:44] Kavana N Murthy: Do u have PDF of first one?
[25/11/21, 17:39:38] Pranav Cr: yeahh
[25/11/21, 17:40:11] Kavana N Murthy: Could u send me that
[25/11/21, 17:40:42] Pranav Cr: Yea one sec
â€[25/11/21, 17:42:51] Pranav Cr: DLD_AAT-1.pdf â€¢ â€3 pages â€<attached: 00000279-DLD_AAT-1.pdf>
[25/11/21, 17:43:04] Kavana N Murthy: No no the answersğŸ˜‚
[25/11/21, 17:43:35] Pranav Cr: answers directly ill send?
[25/11/21, 17:43:41] Kavana N Murthy: Yepp
â€[25/11/21, 17:44:09] Pranav Cr: assignment key answers.pdf â€¢ â€4 pages â€<attached: 00000283-assignment key answers.pdf>
[25/11/21, 17:44:20] Kavana N Murthy: Okies thank you
[25/11/21, 17:45:01] Pranav Cr: ğŸ‘ğŸ‘
[29/11/21, 20:36:32] Kavana N Murthy: Soft skill is on wed no
[29/11/21, 20:37:10] Kavana N Murthy: Oh no wait my bad
[29/11/21, 20:37:11] Kavana N Murthy: ğŸ˜‚
[29/11/21, 20:37:15] Kavana N Murthy: It's Tom only
[29/11/21, 20:37:18] Pranav Cr: It's not.. it's on tueğŸ˜‚ğŸ˜‚ğŸ˜‚
[29/11/21, 20:37:34] Kavana N Murthy: Yes yesğŸ˜‚ğŸ˜‚
[29/11/21, 21:14:46] Pranav Cr: ğŸ˜‚ğŸ˜‚
[30/11/21, 15:15:01] Pranav Cr: #include<iostream>
using namespace std;


class matrix{
    int **ptr;
    public:
    matrix()
    {
        ptr=new int*[2];
        for(int i=0;i<2;i++)
        {
            ptr[i]=new int[2];
        }
    }
    void input()
    {
        for(int i=0;i<2;i++)
            for(int j=0;j<2;j++)
             cin>>*(*(ptr+i)+j);

    }
    void output()
    {
         for(int i=0;i<2;i++)
            {
                cout<<"\n";
                for(int j=0;j<2;j++)
                    cout<<*(*(ptr+i)+j)<<" ";
            }        
    }
};
int main()
{
   class matrix m;
   m.input();
   m.output();
   return 0;
}
[30/11/21, 17:33:26] Kavana N Murthy: Do u have 5 and 6
[30/11/21, 17:33:28] Kavana N Murthy: Answers
[30/11/21, 17:33:32] Kavana N Murthy: For dld?
[30/11/21, 17:33:58] Pranav Cr: No I haven't begun the assignment onlyğŸ¥²ğŸ¥²ğŸ¥²
[30/11/21, 17:34:11] Kavana N Murthy: Oh okiessğŸ‘€ when u do tell me
[30/11/21, 17:34:19] Kavana N Murthy: I did everything except that I wasn't there last class
[30/11/21, 17:34:31] Pranav Cr: Yea okayy
[30/11/21, 17:34:38] Pranav Cr: Only decoders we have to do
[30/11/21, 17:34:40] Pranav Cr: Not the rest
[30/11/21, 17:35:36] Kavana N Murthy: Wait not the PLA?
[30/11/21, 17:36:00] Pranav Cr: What is plağŸ¥²
[30/11/21, 17:36:09] Kavana N Murthy: See that questionğŸ˜‚
[30/11/21, 17:36:12] Kavana N Murthy: 5 and 6
[30/11/21, 17:36:32] Pranav Cr: Has mam done it in class? No na?
[30/11/21, 17:36:38] Kavana N Murthy: No idea
[30/11/21, 17:36:51] Pranav Cr: She hasn't done it ree
[30/11/21, 17:37:11] Kavana N Murthy: Yeah uh then fine
[30/11/21, 17:37:18] Pranav Cr: ğŸ¤¦â€â™‚ï¸ğŸ¤¦â€â™‚ï¸ğŸ˜‚
[30/11/21, 17:37:57] Kavana N Murthy: ğŸ˜‚I thought I was dreaming in class
[30/11/21, 17:38:26] Pranav Cr: Tbh everyone zone out in dldğŸ˜‚
[30/11/21, 17:40:03] Kavana N Murthy: That's trueğŸ˜‚
[30/11/21, 21:25:57] Pranav Cr: ğŸ˜‚
[30/11/21, 21:32:42] Kavana N Murthy: What this ops project topicsğŸ˜‚?
[30/11/21, 21:33:13] Pranav Cr: ğŸ˜‚ğŸ˜‚I will ask her tomorrow ni forgot what she even told
[30/11/21, 21:33:21] Kavana N Murthy: IkrrğŸ˜‚ğŸ˜‚
[30/11/21, 21:35:33] Pranav Cr: ğŸ¤¦â€â™‚ï¸ğŸ˜‚
[01/12/21, 22:51:26] Kavana N Murthy: Ode kodthiniğŸ˜‚ğŸ¤·â€â™€ï¸
[01/12/21, 22:51:35] Kavana N Murthy: I thought we will get screwed
[01/12/21, 22:51:41] Pranav Cr: ğŸ¥²ğŸ˜‚ğŸ˜‚ğŸ˜‚ğŸ˜‚
[01/12/21, 22:51:46] Pranav Cr: I only realised nowğŸ¥²
[01/12/21, 22:51:50] Kavana N Murthy: That sir is full crack it seemsğŸ˜‚ğŸ˜‚
[01/12/21, 22:52:05] Pranav Cr: Eh whaat yea wağŸ¥²
[01/12/21, 22:52:07] Pranav Cr: Who tolddd
[01/12/21, 22:52:23] Kavana N Murthy: Hu other class ppl
[01/12/21, 22:52:25] Kavana N Murthy: Full strict it seems
[01/12/21, 22:52:46] Pranav Cr: Thu ğŸ¥²ğŸ¥²ğŸ¥²ğŸ¥²
[02/12/21, 19:37:12] Kavana N Murthy: U did aat1?ğŸ˜‚
[02/12/21, 19:37:27] Pranav Cr: yuss long back only
[02/12/21, 19:37:37] Kavana N Murthy: Send me no after 6
[02/12/21, 19:37:40] Kavana N Murthy: Question
[02/12/21, 19:38:05] Pranav Cr: yea i will send at 8 it's fine?
[02/12/21, 19:38:13] Kavana N Murthy: Haan okies np
[02/12/21, 19:39:56] Pranav Cr: ğŸ‘
â€[02/12/21, 20:12:29] Pranav Cr: â€<attached: 00000337-PHOTO-2021-12-02-20-12-29.jpg>
â€[02/12/21, 20:12:41] Pranav Cr: â€<attached: 00000338-PHOTO-2021-12-02-20-12-41.jpg>
â€[02/12/21, 20:12:57] Pranav Cr: â€<attached: 00000339-PHOTO-2021-12-02-20-12-57.jpg>
â€[02/12/21, 20:13:07] Pranav Cr: â€<attached: 00000340-PHOTO-2021-12-02-20-13-07.jpg>
â€[02/12/21, 20:13:15] Pranav Cr: â€<attached: 00000341-PHOTO-2021-12-02-20-13-15.jpg>
â€[02/12/21, 20:13:31] Pranav Cr: â€<attached: 00000342-PHOTO-2021-12-02-20-13-31.jpg>
â€[02/12/21, 20:13:35] Pranav Cr: â€<attached: 00000343-PHOTO-2021-12-02-20-13-35.jpg>
â€[02/12/21, 20:13:44] Pranav Cr: â€<attached: 00000344-PHOTO-2021-12-02-20-13-44.jpg>
â€[02/12/21, 20:13:51] Pranav Cr: â€<attached: 00000345-PHOTO-2021-12-02-20-13-51.jpg>
[02/12/21, 20:16:56] Kavana N Murthy: Thank you
[02/12/21, 20:21:16] Pranav Cr: ğŸ‘
[07/12/21, 18:22:20] Kavana N Murthy: Can u make it 7.30 the form?
[07/12/21, 18:22:34] Pranav Cr: Yeah it's 7.30 only
[13/12/21, 09:24:12] Pranav Cr: https://youtu.be/0HD0pqVtsmw first do this
[13/12/21, 09:24:13] Pranav Cr: https://youtu.be/77v-Poud_io watch this
[17/12/21, 20:24:38] Kavana N Murthy: Okies
[17/12/21, 20:24:50] Kavana N Murthy: What's portions for  ops cie2 ?
[17/12/21, 20:25:16] Pranav Cr: Threading, cpu scheduling, deadlocks (might be updated?
[17/12/21, 20:25:26] Pranav Cr: Monday exact syllabus will be decided
[17/12/21, 20:25:35] Kavana N Murthy: Oh okay
[17/12/21, 20:25:44] Kavana N Murthy: So unit 2continuation is there no?
[17/12/21, 20:25:49] Kavana N Murthy: Like full unit 2,
[17/12/21, 20:25:50] Kavana N Murthy: ?
[17/12/21, 20:26:57] Pranav Cr: Yea full unit 2 after process communication
[17/12/21, 20:27:29] Kavana N Murthy: Haan okies
[17/12/21, 20:27:31] Kavana N Murthy: Thank you
[17/12/21, 20:27:47] Pranav Cr: Cool npğŸ‘
[18/12/21, 09:09:30] Kavana N Murthy: What is next class?
[24/12/21, 17:24:24] Kavana N Murthy: Do u have the code for last DSC lab?
[24/12/21, 18:34:39] Pranav Cr: What was the programğŸ¥²?
[24/12/21, 18:35:50] Kavana N Murthy: That double linked list
[24/12/21, 18:36:27] Pranav Cr: I'll check one sec..
[24/12/21, 18:37:22] Kavana N Murthy: Haan okies
[24/12/21, 18:42:12] Pranav Cr: #include<stdio.h>
#include<stdlib.h>
struct node
{
    struct node *prev;
    int info;
    struct node *next;
};
struct node *head=NULL;
int count=0;
void insertbeg(int n)
{
    struct node *newnode;
    newnode=(struct node *)malloc(sizeof(struct node));
    newnode->info=n;
    if(head==NULL)
    {
        newnode->next=NULL;
        newnode->prev=NULL;
        head=newnode;
        return;
    }
    newnode->next=head;
    newnode->prev=NULL;
    head=newnode;
}
void insertbefore()
{
    int n,x;
    printf("Enter the number before which insertion has to take place\n");
    scanf("%d",&n);
    printf("Enter the number to be inserted\n");
    scanf("%d",&x);
    struct node *temp,*newnode,*old;
    temp=head;
    while(temp!=NULL && temp->info!=n)
    {
        //old=temp;
        temp=temp->next;
    }
    if(temp==NULL)
    {
        printf("element not found,unsuccesful insertion\n");
        return;
        
    }
    else if(temp->info==head->info)
    {
        insertbeg(x);
    }
    else

    {
        old=temp->prev;
        printf("%d",old->info);
        newnode=(struct node *)malloc(sizeof(struct node));
        newnode->info=x;
        newnode->next=temp;
        /*
        newnode->prev=temp->prev;
        temp->prev->next=newnode;
        temp->prev=newnode;*/
        old=temp->prev;
        newnode->prev=old;
        old->next=newnode;
        temp->prev=newnode;
        printf("\n Inserted successfully");

    }
}
void deletemid()
{
    struct node *temp=head,*old;
    int i, mid;
    mid=count/2.0;
    if(count%2==0 )
    {
        for(i=1;i<mid;i++)
        {
            old=temp;
            temp=temp->next;
        }
    }
    
    else
    {
        for(i=1;i<=mid;i++)
        {
            old=temp;
            temp=temp->next;
        }

    }
    old->next=temp->next;
    free(temp);
    
}
void traverse()
{
    struct node *temp=head;
    if(head==NULL)
    {
        printf("empty list");
        return;
    }
    while(temp!=NULL)
    {
        printf("<--%d-->",temp->info);
        temp=temp->next;
        count++;
    }
}
void main()
{
    int n,choice;
    for(;;)
    {
        printf("\n1.Insert begin\n2.Traverse\n");
        scanf("%d",&choice);
        switch(choice)
        {
            case 1:
            printf("enter the number");
            scanf("%d",&n);
            insertbeg(n);
            break;
            case 2:
            traverse();
            break;
            case 3:
            insertbefore();
            break;
            case 4:
            deletemid();
            break;
            default:
            exit(0);
        }
    }
}
[24/12/21, 18:42:34] Kavana N Murthy: Thank you
[24/12/21, 18:44:42] Pranav Cr: np!
[28/12/21, 14:02:32] Kavana N Murthy: How many oops lab can we bunk?
[28/12/21, 14:08:29] Pranav Cr: Only one
[29/12/21, 19:53:56] Kavana N Murthy: Answer for this?
[29/12/21, 19:53:59] Kavana N Murthy: U have?
[29/12/21, 19:54:22] Pranav Cr: No i haven't written it yetğŸ¥²
[29/12/21, 20:00:02] Kavana N Murthy: Any pdf answer atleast?ğŸ‘€
[29/12/21, 20:03:01] Pranav Cr: NopeğŸ¥²
[29/12/21, 20:22:19] Kavana N Murthy: Chey tomorrow we have all the classes?
[29/12/21, 20:22:48] Pranav Cr: it does look lik it
[29/12/21, 20:23:09] Kavana N Murthy: Ayyo
[29/12/21, 20:23:22] Pranav Cr: ğŸ¥²ğŸ¥²
[30/12/21, 20:27:50] Kavana N Murthy: Only this
[30/12/21, 20:27:52] Kavana N Murthy: Tomo?
[30/12/21, 20:28:10] Pranav Cr: no no morning classes will be there
[30/12/21, 20:28:30] Kavana N Murthy: So oops dsc math
[30/12/21, 20:28:40] Pranav Cr: yeah
[30/12/21, 20:35:34] Kavana N Murthy: Mass bunk tom or sat?
[30/12/21, 20:45:45] Pranav Cr: Saturday
[30/12/21, 20:45:55] Pranav Cr: â€This message was deleted.
[30/12/21, 20:46:06] Pranav Cr: No mass bunk tmrw
[30/12/21, 20:46:08] Kavana N Murthy: Okies
[30/12/21, 20:46:15] Pranav Cr: ğŸ‘
[31/12/21, 20:03:15] Kavana N Murthy: Doubly linked list
[31/12/21, 20:03:30] Kavana N Murthy: What all operations should be written in record
[31/12/21, 21:24:17] Pranav Cr: Insertion at beginning and deletion of middle element
[31/12/21, 21:48:03] Kavana N Murthy: Only those two?
[31/12/21, 21:48:30] Pranav Cr: Yes
[01/01/22, 09:04:22] Kavana N Murthy: Happy new year!!ğŸ‰âœ¨
[01/01/22, 09:19:25] Pranav Cr: Thank youu! Wish you the same
[02/01/22, 19:11:18] Kavana N Murthy: No need to write other two no
[02/01/22, 19:11:33] Pranav Cr: actiually write everything
[02/01/22, 19:11:38] Pranav Cr: or else output eont match
[02/01/22, 19:11:41] Pranav Cr: wont*
[02/01/22, 19:11:44] Kavana N Murthy: Yeah uh
[02/01/22, 19:12:37] Pranav Cr: yeaa
[02/01/22, 19:12:50] Kavana N Murthy: Fine fine I'll write it then
[02/01/22, 19:13:06] Pranav Cr: okayy
[03/01/22, 21:04:05] Kavana N Murthy: Can u send oops
[03/01/22, 21:04:08] Kavana N Murthy: Observation
[03/01/22, 21:04:14] Kavana N Murthy: Last class and the other last class
[03/01/22, 21:21:03] Pranav Cr: Yea I'll send in 10 mins
[03/01/22, 21:25:22] Kavana N Murthy: Haan okay
[03/01/22, 21:27:02] Pranav Cr: Last week's i haven't written yet
[03/01/22, 21:27:09] Pranav Cr: Before last week's I'll send?
[03/01/22, 21:27:15] Kavana N Murthy: Haan it's okay
[03/01/22, 21:28:16] Pranav Cr: Turns out I haven't written that alsoğŸ˜‚ğŸ˜‚
[03/01/22, 21:28:25] Pranav Cr: ğŸ¥²
[03/01/22, 21:30:36] Kavana N Murthy: Yeah uh she didn't correct?ğŸ˜‚
[03/01/22, 21:31:01] Pranav Cr: She was absent lolğŸ˜‚
[03/01/22, 21:31:06] Kavana N Murthy: Oh yah knowğŸ˜‚
[03/01/22, 21:31:16] Pranav Cr: YeahhğŸ˜‚ tomorrow morning I'll writeğŸ˜‚
[03/01/22, 21:31:24] Kavana N Murthy: Fine fine issokayğŸ˜‚
[03/01/22, 21:31:34] Pranav Cr: ğŸ˜‚ğŸ˜‚ğŸ˜‚yeah
[05/01/22, 16:32:37] Kavana N Murthy: Any updates about Tom class
[05/01/22, 16:32:40] Kavana N Murthy: Offline or online?
[05/01/22, 16:33:13] Pranav Cr: Nothing yet but mostly online will confirm it asap
[05/01/22, 16:33:20] Kavana N Murthy: Acha okies
[05/01/22, 17:43:21] Kavana N Murthy: Hod told?
[05/01/22, 17:43:32] Pranav Cr: Principal
[05/01/22, 17:43:36] Kavana N Murthy: Oh okay
[07/01/22, 09:17:50] Kavana N Murthy: There is none in the meet?
[07/01/22, 09:18:02] Pranav Cr: Yeah mam ended the meet by mistake
[07/01/22, 09:18:07] Kavana N Murthy: Oh okayğŸ˜‚
[07/01/22, 09:18:11] Pranav Cr: She is restarting the systemğŸ˜‚
[07/01/22, 09:18:44] Kavana N Murthy: Good only ğŸ˜‚
[07/01/22, 09:19:11] Pranav Cr: ğŸ˜‚ğŸ˜‚
[07/01/22, 10:09:36] Kavana N Murthy: What campaign?
[07/01/22, 10:10:12] Pranav Cr: No clue just forwarded the msgğŸ˜‚
[07/01/22, 10:10:18] Kavana N Murthy: Oh okayğŸ˜‚
[07/01/22, 10:10:30] Pranav Cr: ğŸ˜‚
[10/01/22, 21:22:56] Kavana N Murthy: That oops Excel sheet u have?
[10/01/22, 21:23:02] Kavana N Murthy: I wanted to check which all topics are taken
[10/01/22, 21:23:12] Pranav Cr: Oh that wait lemme see
[10/01/22, 21:23:20] Kavana N Murthy: Haan okies
â€[10/01/22, 21:24:50] Pranav Cr: Oops form (Responses).pdf â€<attached: 00000447-Oops form (Responses).pdf>
[10/01/22, 21:31:43] Kavana N Murthy: Thank you
[15/01/22, 18:53:35] Kavana N Murthy: I didn't get it
[15/01/22, 18:53:40] Kavana N Murthy: This*
[15/01/22, 18:53:44] Kavana N Murthy: What's this 55-60
[15/01/22, 18:53:55] Pranav Cr: USN's allotted
[15/01/22, 18:54:11] Kavana N Murthy: Why isn't that link working
[15/01/22, 18:54:13] Kavana N Murthy: It says it's down
[15/01/22, 18:54:18] Kavana N Murthy: Is it for u too?
[15/01/22, 18:54:35] Pranav Cr: Yeah it's not working for anyone
[15/01/22, 18:59:38] Kavana N Murthy: Oh okay
[15/01/22, 18:59:52] Kavana N Murthy: U told her?
[15/01/22, 19:01:15] Pranav Cr: Yepp
[16/01/22, 19:11:38] Kavana N Murthy: U submitted oops?
[16/01/22, 19:19:21] Pranav Cr: No.. it's not working for me
[16/01/22, 22:38:34] Kavana N Murthy: Dsc
[16/01/22, 22:38:37] Kavana N Murthy: Did u do?
[17/01/22, 08:54:06] Pranav Cr: Yeahh uploaded it a while back
[17/01/22, 11:14:41] Kavana N Murthy: Send no
â€[17/01/22, 11:19:25] Pranav Cr: bstthread.txt â€<attached: 00000466-bstthread.txt>
[17/01/22, 11:22:21] Kavana N Murthy: Thank you
[19/01/22, 12:09:16] Kavana N Murthy: Do uk who else doesn't have a partner?
[19/01/22, 12:09:41] Kavana N Murthy: For dsc
[19/01/22, 12:09:43] Kavana N Murthy: Project
[19/01/22, 12:11:29] Pranav Cr: I think all ppl ik have..
[19/01/22, 12:11:39] Pranav Cr: I'll ask and let uk..
[19/01/22, 12:12:01] Kavana N Murthy: Is there any way
[19/01/22, 12:12:07] Kavana N Murthy: We do 4 in a group?
[19/01/22, 12:12:14] Pranav Cr: 4 mam won't agree
[19/01/22, 12:12:19] Pranav Cr: But you can do 2 each
[19/01/22, 12:12:25] Kavana N Murthy: Cause everyone got partners
[19/01/22, 12:12:27] Kavana N Murthy: Oh okay
[19/01/22, 12:12:32] Pranav Cr: Yeahh
[19/01/22, 12:12:42] Pranav Cr: Or you can do single also
[19/01/22, 12:12:47] Pranav Cr: I mean if you want to
[19/01/22, 12:14:23] Kavana N Murthy: Oh okay
[21/01/22, 21:15:28] Kavana N Murthy: Srslyyy?ğŸ˜‚ for this
[21/01/22, 21:16:07] Pranav Cr: I was honestly boredğŸ˜‚
[21/01/22, 21:16:15] Kavana N Murthy: Yeah knowğŸ˜‚
[21/01/22, 21:16:22] Kavana N Murthy: Which will we have normal classes
[21/01/22, 21:17:49] Pranav Cr: Offline?
[21/01/22, 21:17:55] Kavana N Murthy: Yess
[21/01/22, 21:17:58] Pranav Cr: Maybe February
[21/01/22, 21:18:05] Kavana N Murthy: It's too boring now online
[21/01/22, 21:18:20] Pranav Cr: Online is always boringğŸ˜‚
[21/01/22, 21:18:26] Kavana N Murthy: YeahğŸ˜‚
[21/01/22, 21:18:42] Pranav Cr: Offline at least is fun in bunking and allğŸ˜‚
[21/01/22, 21:19:03] Kavana N Murthy: ExactlyğŸ˜‚
[21/01/22, 21:19:06] Kavana N Murthy: Oh shit the audioğŸ˜‚
[21/01/22, 21:19:08] Kavana N Murthy: Trippy
[21/01/22, 21:20:12] Pranav Cr: Wait lemme hearğŸ˜‚
[21/01/22, 21:22:15] Kavana N Murthy: YeahğŸ˜‚
[21/01/22, 22:39:45] Pranav Cr: That wasğŸ˜‚ğŸ˜‚
[24/01/22, 14:21:58] Kavana N Murthy: Is it compulsory
[24/01/22, 14:22:07] Kavana N Murthy: Cause I'm having net issues
[24/01/22, 14:22:10] Kavana N Murthy: Meet is crashing?
[24/01/22, 14:22:17] Pranav Cr: yea mam told it is compulsory
[24/01/22, 14:22:35] Kavana N Murthy: It has marks?
[24/01/22, 14:23:06] Pranav Cr: yea ig
[24/01/22, 22:29:18] Kavana N Murthy: What time is soft skill test
[24/01/22, 22:29:33] Pranav Cr: During class i.e 9-11
[24/01/22, 22:30:11] Kavana N Murthy: Oh okay
[26/01/22, 20:44:47] Kavana N Murthy: Ops demo
[26/01/22, 20:44:52] Kavana N Murthy: Should we just make a ppt on the topic
[26/01/22, 20:44:58] Kavana N Murthy: Or write a code?
[26/01/22, 21:36:17] Pranav Cr: Both actually..
[26/01/22, 23:25:04] Kavana N Murthy: Oh okay
[28/01/22, 21:43:45] Kavana N Murthy: How many marks is this wad project
[28/01/22, 21:44:53] Pranav Cr: 20 marks
[28/01/22, 21:45:06] Kavana N Murthy: So like tell me the subject split up
[28/01/22, 21:45:23] Pranav Cr: 20 marks project
[28/01/22, 21:45:28] Pranav Cr: 5 marks quiz
[28/01/22, 21:45:33] Pranav Cr: 25 marks one internals
[28/01/22, 21:45:43] Pranav Cr: 50 mark SEE(converted)
[28/01/22, 21:46:02] Kavana N Murthy: So it will be 100 right like then they will reduce to 50
[28/01/22, 21:46:08] Pranav Cr: Yupp
[28/01/22, 21:46:54] Kavana N Murthy: So how will it be like one question or each question from one topic?
[28/01/22, 21:48:32] Pranav Cr: One big question for 100 marks
[28/01/22, 21:48:53] Kavana N Murthy: Oh okay
[28/01/22, 21:50:56] Kavana N Murthy: No viva for this?
[28/01/22, 22:07:32] Pranav Cr: Nope..
[29/01/22, 14:55:42] Kavana N Murthy: Pakka?
[29/01/22, 14:56:37] Pranav Cr: Yupp department confirmed
[29/01/22, 14:56:46] Kavana N Murthy: Oh okay
[29/01/22, 15:00:44] Kavana N Murthy: I thought it was for first sem
[29/01/22, 15:01:30] Pranav Cr: Yea for 3rd sem also i confirmed
[29/01/22, 15:05:25] Kavana N Murthy: Oh Olaf
[29/01/22, 15:05:27] Kavana N Murthy: Okay*
[30/01/22, 13:30:07] Kavana N Murthy: Should we use php
[30/01/22, 13:30:11] Kavana N Murthy: Compulsory
[30/01/22, 13:30:23] Pranav Cr: Yupp it's compulsory
[30/01/22, 13:30:26] Kavana N Murthy: In the project
[30/01/22, 13:30:29] Kavana N Murthy: Oh okay
[30/01/22, 16:20:25] Kavana N Murthy: Dear Sir/Madam

 

In accordance with the Govt. order dated 29.1.2022, please note that the college will function with 100% staff strength with effect from 31.1.2022(Monday) with normal prescribed timings.  All the faculty and staff members are requested to adhere to the prevailing SOPs during their stay at the campus.  The classes shall be conducted offline at the college campus.

 

HODs are hereby requested to bring this to the notice of all the stake holders in the department.

 

With best wishes...

 

Dr. S Muralidhara

Principal
B.M.S. College of Engineering,
Bangalore - 560 019.

Phone +918022427424


FYI
Show quoted text
--
Regards
Dr. M Dakshayini,
Professor, Dept. of ISE, 
BMSCE, Bengaluru
[30/01/22, 16:20:33] Kavana N Murthy: Is it Tomo or day after?
[30/01/22, 16:57:31] Pranav Cr: Actually we don't have clarity yet. We are asking the teachers and tell asap we get to know something
[31/01/22, 20:38:39] Kavana N Murthy: Dld and ops?
[31/01/22, 20:40:03] Pranav Cr: We are still asking..
[31/01/22, 20:40:21] Kavana N Murthy: Oh okay
[01/02/22, 15:26:53] Kavana N Murthy: Did u finish all of them?
[01/02/22, 15:27:35] Pranav Cr: Yupp
[01/02/22, 15:27:41] Kavana N Murthy: Could you send me those
â€[01/02/22, 15:28:11] Pranav Cr: oopslab12.pdf â€¢ â€3 pages â€<attached: 00000549-oopslab12.pdf>
[01/02/22, 15:30:26] Kavana N Murthy: Thank you
[01/02/22, 15:31:01] Kavana N Murthy: Thank you
[02/02/22, 23:30:57] Kavana N Murthy: Do u have coa spreadsheet
[03/02/22, 07:12:07] Pranav Cr: It's there in classroom
â€[03/02/22, 07:12:12] Pranav Cr: â€<attached: 00000554-PHOTO-2022-02-03-07-12-12.jpg>
[03/02/22, 07:32:45] Kavana N Murthy: Thank you
[03/02/22, 08:11:52] Kavana N Murthy: This coa 12/20 or 12/40
[03/02/22, 08:11:58] Kavana N Murthy: We should write
[03/02/22, 08:15:33] Pranav Cr: 12/40
[04/02/22, 11:09:48] Kavana N Murthy: Oh okay
[04/02/22, 11:09:58] Kavana N Murthy: Do u have the sem schedule?
[04/02/22, 11:23:00] Pranav Cr: Yea one sec
â€[04/02/22, 11:23:21] Pranav Cr: Consolidated Calendar of Events for the Odd Sem for UG and PG programs AY 2021-22 (28.01.2022).pdf â€¢ â€1 page â€<attached: 00000562-Consolidated Calendar of Events for the Odd Sem for UG and PG programs AY 2021-22 (28.01.2022).pdf>
[04/02/22, 11:23:36] Kavana N Murthy: Thank you
[08/02/22, 17:35:08] Kavana N Murthy: Do you have the paper?
â€[08/02/22, 17:35:51] Pranav Cr: COA TEST 1 PAPER 2021-22 (1).docx.pdf â€¢ â€1 page â€<attached: 00000565-COA TEST 1 PAPER 2021-22 (1).docx.pdf>
[08/02/22, 17:36:15] Kavana N Murthy: Thank you
[08/02/22, 17:48:52] Kavana N Murthy: Do uk
[08/02/22, 17:48:58] Kavana N Murthy: How to login to that soft skills?
[08/02/22, 17:52:06] Pranav Cr: Yea go to the link and enter the access code yhats all
[08/02/22, 17:52:17] Kavana N Murthy: I'm not getting that
[08/02/22, 17:52:26] Pranav Cr: Access code?
[08/02/22, 17:52:30] Pranav Cr: I put it in main grp
â€[08/02/22, 17:53:03] Kavana N Murthy: â€<attached: 00000573-VIDEO-2022-02-08-17-53-03.mp4>
[08/02/22, 17:54:42] Pranav Cr: Login?
â€[08/02/22, 17:55:04] Kavana N Murthy: â€<attached: 00000575-PHOTO-2022-02-08-17-55-04.jpg>
[08/02/22, 17:55:10] Kavana N Murthy: There it's no option to register also
[08/02/22, 17:55:30] Pranav Cr: Try college email id and that access code as password
[08/02/22, 17:55:42] Kavana N Murthy: Didn't work
[08/02/22, 17:55:47] Kavana N Murthy: Message that Ma'am and ask no
[08/02/22, 17:56:13] Pranav Cr: Yea okay
[08/02/22, 17:56:20] Kavana N Murthy: Haan
â€[09/02/22, 12:39:42] Kavana N Murthy: â€<attached: 00000582-PHOTO-2022-02-09-12-39-42.jpg>
[09/02/22, 12:39:47] Kavana N Murthy: These 4 no?
[09/02/22, 12:46:59] Pranav Cr: Yeahh
â€[09/02/22, 13:16:58] Kavana N Murthy: â€<attached: 00000585-PHOTO-2022-02-09-13-16-58.jpg>
â€[09/02/22, 13:16:58] Kavana N Murthy: â€<attached: 00000586-PHOTO-2022-02-09-13-16-58.jpg>
[09/02/22, 13:17:07] Kavana N Murthy: This first question answer is it this??
[09/02/22, 13:18:36] Pranav Cr: Yep and the next slide
[09/02/22, 13:18:42] Kavana N Murthy: Okies thank you
â€[09/02/22, 13:40:23] Kavana N Murthy: â€<attached: 00000590-PHOTO-2022-02-09-13-40-23.jpg>
[09/02/22, 13:40:34] Kavana N Murthy: Do u have the answers for this whole part?
[09/02/22, 14:17:27] Pranav Cr: Nope... I don't have. Although you can find similar questions in mam's ppt
[09/02/22, 14:35:41] Kavana N Murthy: Oh okay fine
[10/02/22, 11:10:02] Kavana N Murthy: link?
[10/02/22, 11:15:33] Pranav Cr: Mam hasn't sent yet..
[14/02/22, 14:35:57] Kavana N Murthy: Where is this
[14/02/22, 14:35:58] Kavana N Murthy: Exactly
[14/02/22, 14:37:39] Pranav Cr: Gavipuram..
[14/02/22, 14:37:58] Kavana N Murthy: Could u send the address
[14/02/22, 14:38:02] Kavana N Murthy: Like what is the event about
[14/02/22, 14:39:09] Pranav Cr: its lik wehelp them in packaging food
[14/02/22, 14:39:15] Kavana N Murthy: Oh okay like that
[14/02/22, 14:39:26] Pranav Cr: https://g.co/kgs/gBB2vU
[14/02/22, 14:39:29] Pranav Cr: Yupp
[14/02/22, 14:40:10] Kavana N Murthy: Thank you
[16/02/22, 12:24:02] Kavana N Murthy: What's math CIE 2
[16/02/22, 12:24:06] Kavana N Murthy: Portion
[16/02/22, 12:24:26] Pranav Cr: I think unit 2 and 3
[16/02/22, 12:24:31] Pranav Cr: Will confirm and tell
[16/02/22, 12:24:38] Kavana N Murthy: That is combination and statistics?
[16/02/22, 12:24:45] Kavana N Murthy: I mean probability*
[16/02/22, 12:24:46] Pranav Cr: Yepp
[16/02/22, 12:24:51] Kavana N Murthy: Okies
[16/02/22, 20:39:58] Kavana N Murthy: Tomorrow what all classes are confirmed?
[16/02/22, 20:40:15] Pranav Cr: Everything until 2.55
[16/02/22, 20:40:23] Kavana N Murthy: Oh okay fine
[18/02/22, 16:28:46] Kavana N Murthy: Coa Monday what time we need to present?
[18/02/22, 16:29:35] Pranav Cr: Will ask mam and let uk
[18/02/22, 16:29:40] Kavana N Murthy: Haan okay
[18/02/22, 16:33:49] Kavana N Murthy: Also what's coa CIE portion
[18/02/22, 16:34:09] Pranav Cr: Mam hasn't told yet..
[18/02/22, 16:35:01] Kavana N Murthy: Oh okay
[19/02/22, 13:12:13] Kavana N Murthy: Only that demo no
[19/02/22, 13:13:05] Pranav Cr: Yeah
[19/02/22, 13:13:29] Kavana N Murthy: Also can we change the topic?
[19/02/22, 13:14:05] Pranav Cr: I don't think so . You have to ask mam once..
[19/02/22, 13:14:13] Kavana N Murthy: Oh okay fine
[20/02/22, 21:49:41] Kavana N Murthy: How many min each presentation it will take?
[20/02/22, 21:49:53] Pranav Cr: 10 mins
[20/02/22, 21:50:01] Kavana N Murthy: Oh okay fine
[20/02/22, 21:50:17] Kavana N Murthy: It will be according that spreadsheet order?
[20/02/22, 21:50:26] Pranav Cr: yeah the one i shared today
[20/02/22, 21:50:29] Kavana N Murthy: Okies
[21/02/22, 11:06:26] Kavana N Murthy: Till when we have ops?
[21/02/22, 11:06:58] Pranav Cr: I think till 1
[21/02/22, 21:29:53] Kavana N Murthy: What time we have coa tom?
[21/02/22, 21:37:24] Pranav Cr: Mam hasn't told yet..
[21/02/22, 21:43:56] Kavana N Murthy: Oh okay
[23/02/22, 12:44:34] Kavana N Murthy: Do u have
[23/02/22, 12:44:37] Kavana N Murthy: Ops
[23/02/22, 12:45:20] Kavana N Murthy: Project
[23/02/22, 12:58:27] Pranav Cr: No bro
[24/02/22, 11:35:04] Pranav Cr: https://www.os-book.com/OS10/slide-dir/index.html
[24/02/22, 21:18:55] Kavana N Murthy: Is it front end demo or whole project?
[24/02/22, 21:37:06] Pranav Cr: final bro
[25/02/22, 00:15:02] Kavana N Murthy: Oh okay
[27/02/22, 18:18:06] Kavana N Murthy: We have oops lab exam or something this week?
[27/02/22, 18:18:24] Pranav Cr: lemme check bro
[27/02/22, 18:18:37] Kavana N Murthy: Haan okay
[27/02/22, 18:19:03] Pranav Cr: no bro
[27/02/22, 18:19:15] Kavana N Murthy: Oh Okay thank you
[28/02/22, 08:45:43] Kavana N Murthy: What are we supposed to do?
[28/02/22, 09:11:13] Pranav Cr: You have to buy a temporary one and then get it
[28/02/22, 09:52:07] Kavana N Murthy: Oh okay
[28/02/22, 21:00:52] Kavana N Murthy: What are the portions exactly
[28/02/22, 21:00:55] Kavana N Murthy: For coa
[28/02/22, 21:01:04] Kavana N Murthy: Like unit 2 from which part
[28/02/22, 21:02:47] Pranav Cr: Unit 2 from handling multiple interrupts excluding bus and interface units
[28/02/22, 21:03:16] Kavana N Murthy: Oh okay then unit 3 full?
[28/02/22, 21:03:44] Pranav Cr: Yess
[28/02/22, 21:03:56] Kavana N Murthy: Unit 4?
[28/02/22, 21:04:13] Pranav Cr: Not there
[28/02/22, 21:05:11] Kavana N Murthy: So unit 2 only handling interrupt and dma
[28/02/22, 21:05:15] Kavana N Murthy: Right?
[28/02/22, 21:06:01] Pranav Cr: Yess
[28/02/22, 21:07:25] Kavana N Murthy: Okies thank you
[28/02/22, 21:15:21] Kavana N Murthy: Deadlock we have numericals?
[28/02/22, 21:49:16] Pranav Cr: Yeah bankers and safety algo
[02/03/22, 00:24:03] Kavana N Murthy: Should both the team mates log in the meet or one can log in and both can speak?
[02/03/22, 08:56:54] Pranav Cr: Both should login and speak
[02/03/22, 09:41:42] Kavana N Murthy: What time she will send link?
[02/03/22, 09:50:57] Pranav Cr: Shortly
[02/03/22, 18:05:42] Kavana N Murthy: Can u send Kannada portions
[02/03/22, 18:06:04] Pranav Cr: i have put in main grp i will retag
[02/03/22, 18:07:23] Kavana N Murthy: Haan okay
â€[02/03/22, 22:56:07] Kavana N Murthy: â€<attached: 00000676-PHOTO-2022-03-02-22-56-07.jpg>
[02/03/22, 22:56:07] Kavana N Murthy: What is 4 types+ application
[02/03/22, 22:59:44] Pranav Cr: Universal shift register
[02/03/22, 22:59:50] Pranav Cr: Johnson ring counter
[02/03/22, 22:59:52] Pranav Cr: And ring counter
[03/03/22, 08:15:11] Kavana N Murthy: Oh Okay
[04/03/22, 15:10:36] Kavana N Murthy: Oops unit 4 is not there?
[04/03/22, 15:12:57] Pranav Cr: Irs there
[04/03/22, 15:13:02] Pranav Cr: First part polymorphism
[04/03/22, 15:16:31] Kavana N Murthy: But for the other class they said it's not there today
[04/03/22, 15:16:57] Pranav Cr: Yea I heard about that. Will get it clarified
[04/03/22, 15:19:36] Kavana N Murthy: Haan okay
â€[08/03/22, 20:45:22] Kavana N Murthy: â€<attached: 00000688-PHOTO-2022-03-08-20-45-22.jpg>
[08/03/22, 20:45:25] Kavana N Murthy: This one?
[08/03/22, 20:49:32] Pranav Cr: No not that
[08/03/22, 20:49:37] Pranav Cr: It's not there in the ppt dw
[08/03/22, 20:49:42] Kavana N Murthy: Oh okay fine
[10/03/22, 13:33:03] Kavana N Murthy: Kannada is at 2 no?
[10/03/22, 14:40:43] Kavana N Murthy: Is it online? In class?
[10/03/22, 16:25:56] Pranav Cr: In lab
[10/03/22, 16:26:00] Pranav Cr: Yeah
[11/03/22, 19:39:41] Kavana N Murthy: What time is the seminar room
[11/03/22, 19:39:42] Kavana N Murthy: Tom*
[11/03/22, 20:13:16] Pranav Cr: Seminar isn't tomorrow bro
[11/03/22, 20:13:29] Kavana N Murthy: So nothing then Tomo?
[11/03/22, 20:13:54] Pranav Cr: Nopeee
[13/03/22, 21:55:17] Kavana N Murthy: How many marks is ops aat for?
[13/03/22, 22:11:52] Pranav Cr: 10
[13/03/22, 22:13:37] Kavana N Murthy: Oh okay
[14/03/22, 11:21:10] Kavana N Murthy: Till when is the class?
[14/03/22, 11:21:40] Pranav Cr: 1pm
[14/03/22, 18:02:17] Kavana N Murthy: Will 2nd batch have it?
[14/03/22, 18:04:45] Pranav Cr: No. Day after for the rest ..
[14/03/22, 18:09:24] Kavana N Murthy: Oh okay
[14/03/22, 19:20:02] Kavana N Murthy: And what all classes do u have tomorrow?
[14/03/22, 19:22:09] Pranav Cr: I'll update shortly
[14/03/22, 19:22:45] Kavana N Murthy: Haan okay
[14/03/22, 21:23:52] Kavana N Murthy: The lab exam we have on 22 will they reduce it to 10 marks or what?
[14/03/22, 21:24:07] Kavana N Murthy: It's lab 1-10 and lab 2-10?
[14/03/22, 21:25:01] Pranav Cr: Yeah that's what's written in the assessment
[14/03/22, 21:25:10] Kavana N Murthy: Not 15 and 5 no
[14/03/22, 21:25:17] Pranav Cr: I doubt that
[14/03/22, 21:25:22] Kavana N Murthy: Haan okies
[15/03/22, 11:45:07] Kavana N Murthy: What is the portions for oops lab exam on 22?
[15/03/22, 12:00:06] Pranav Cr: Full syllabus
[15/03/22, 12:10:54] Kavana N Murthy: But she told for other class it's 7-12 lab set
[15/03/22, 12:10:55] Kavana N Murthy: Similar ones
[15/03/22, 13:29:06] Pranav Cr: Wait I'll ask and let uk
[15/03/22, 15:00:42] Kavana N Murthy: Send shubha Ma'am number no?
â€[15/03/22, 15:08:16] Pranav Cr: â€<attached: 00000725-Shubha Rao Mam Ise.vcf>
[15/03/22, 15:10:11] Kavana N Murthy: Thank you
[15/03/22, 18:32:36] Kavana N Murthy: Is the quiz written
[15/03/22, 18:32:38] Kavana N Murthy: Or in the lab?
[15/03/22, 18:32:54] Pranav Cr: Written quiz
[15/03/22, 20:36:54] Kavana N Murthy: Oh okay
[15/03/22, 20:36:56] Kavana N Murthy: Do u have
[15/03/22, 20:36:59] Kavana N Murthy: Template for
[15/03/22, 20:37:00] Kavana N Murthy: That
[15/03/22, 20:37:05] Kavana N Murthy: Report?
[15/03/22, 20:41:46] Pranav Cr: It's there in classroom
[15/03/22, 20:42:49] Kavana N Murthy: okies
[16/03/22, 18:51:01] Kavana N Murthy: So only dld quiz Tom?
[16/03/22, 18:51:16] Pranav Cr: Yepp
[16/03/22, 18:51:18] Kavana N Murthy: Okies
[19/03/22, 11:17:51] Kavana N Murthy: Coa Quiz
[19/03/22, 11:17:54] Kavana N Murthy: Portions?
[19/03/22, 11:18:42] Pranav Cr: 1-3 units
[19/03/22, 11:18:55] Kavana N Murthy: Including 3rd?
[19/03/22, 11:19:00] Pranav Cr: Yeah
[19/03/22, 11:19:03] Kavana N Murthy: Okies
[20/03/22, 14:10:51] Kavana N Murthy: We have attendance for that
[20/03/22, 14:10:53] Kavana N Murthy: Workshop?
[20/03/22, 14:11:08] Pranav Cr: Yeaa
[20/03/22, 14:11:15] Kavana N Murthy: Google forms?
[20/03/22, 14:11:20] Kavana N Murthy: Also what about the quiz then?
[20/03/22, 14:11:28] Pranav Cr: No no it's offline
[20/03/22, 14:11:33] Kavana N Murthy: Oh okay
[20/03/22, 14:11:34] Pranav Cr: It's just for half an hour
[20/03/22, 14:11:43] Kavana N Murthy: Oh okay fine
[20/03/22, 14:12:08] Kavana N Murthy: How will the attendance be taken?
[20/03/22, 14:12:29] Pranav Cr: Not sure maybe they will call out names
[20/03/22, 14:15:10] Kavana N Murthy: Oh okay fine
[20/03/22, 19:42:58] Kavana N Murthy: No classes tomorrow?
[20/03/22, 19:47:43] Pranav Cr: mam is yet to reply
[20/03/22, 20:11:29] Kavana N Murthy: Oh okay
[20/03/22, 20:49:48] Kavana N Murthy: Only 7-11 lab set no?
[20/03/22, 20:49:52] Kavana N Murthy: And similar ones?
[20/03/22, 20:50:09] Pranav Cr: U won't get programs from lab
[20/03/22, 20:50:14] Pranav Cr: Only similar ones
[20/03/22, 20:50:24] Kavana N Murthy: But A section ppl got the same ones apparently
[20/03/22, 20:50:30] Kavana N Murthy: Like 50 percent of the class
[20/03/22, 20:50:39] Kavana N Murthy: Shubha Ma'am only
[20/03/22, 20:50:55] Pranav Cr: Yeah but mam told this so I conveyed she might change no..
[20/03/22, 20:51:02] Kavana N Murthy: Oh okay like that
[20/03/22, 20:51:16] Pranav Cr: Yeah
[21/03/22, 18:29:58] Kavana N Murthy: Send pics on observation no after diamond problem
[21/03/22, 18:35:50] Pranav Cr: 11.#include<iostream>
using namespace std;
class expression
{
    int a,d;
public:
    void read()
    {
        cin>>a>>d;
    }
    void exp()
    {
        if(d==0)
        {
            throw 0;
        }
            cout<<a/d;
    }
};
int main()
{
    expression e1;
    e1.read();
    while(true)
    {
        try{
            e1.exp();
            break;
           }
           catch(int &e)
           {
               cout<<"divide by zero\n";
               e1.read();
           }
    }
    return 0;
}
â€[21/03/22, 18:35:51] Pranav Cr: â€<attached: 00000773-PHOTO-2022-03-21-18-35-51.jpg>
â€[21/03/22, 18:35:52] Pranav Cr: â€<attached: 00000774-PHOTO-2022-03-21-18-35-52.jpg>
â€[21/03/22, 18:35:53] Pranav Cr: â€<attached: 00000775-PHOTO-2022-03-21-18-35-53.jpg>
â€[21/03/22, 18:35:53] Pranav Cr: â€<attached: 00000776-PHOTO-2022-03-21-18-35-53.jpg>
â€[21/03/22, 18:35:54] Pranav Cr: â€<attached: 00000777-PHOTO-2022-03-21-18-35-54.jpg>
â€[21/03/22, 18:35:54] Pranav Cr: â€<attached: 00000778-PHOTO-2022-03-21-18-35-54.jpg>
â€[21/03/22, 18:35:55] Pranav Cr: â€<attached: 00000779-PHOTO-2022-03-21-18-35-55.jpg>
â€[21/03/22, 18:35:55] Pranav Cr: â€<attached: 00000780-PHOTO-2022-03-21-18-35-55.jpg>
â€[21/03/22, 18:35:56] Pranav Cr: â€<attached: 00000781-PHOTO-2022-03-21-18-35-56.jpg>
â€[21/03/22, 18:35:57] Pranav Cr: â€<attached: 00000782-PHOTO-2022-03-21-18-35-57.jpg>
â€[21/03/22, 18:35:57] Pranav Cr: â€<attached: 00000783-PHOTO-2022-03-21-18-35-57.jpg>
â€[21/03/22, 18:35:58] Pranav Cr: â€<attached: 00000784-PHOTO-2022-03-21-18-35-58.jpg>
â€[21/03/22, 18:35:59] Pranav Cr: â€<attached: 00000785-PHOTO-2022-03-21-18-35-59.jpg>
â€[21/03/22, 18:35:59] Pranav Cr: â€<attached: 00000786-PHOTO-2022-03-21-18-35-59.jpg>
â€[21/03/22, 18:36:00] Pranav Cr: â€<attached: 00000787-PHOTO-2022-03-21-18-36-00.jpg>
â€[21/03/22, 18:36:00] Pranav Cr: â€<attached: 00000788-PHOTO-2022-03-21-18-36-00.jpg>
â€[21/03/22, 18:36:01] Pranav Cr: â€<attached: 00000789-PHOTO-2022-03-21-18-36-01.jpg>
â€[21/03/22, 18:36:02] Pranav Cr: â€<attached: 00000790-PHOTO-2022-03-21-18-36-02.jpg>
[21/03/22, 18:36:28] Kavana N Murthy: Thank you
[22/03/22, 21:36:15] Kavana N Murthy: She won't mind?
[22/03/22, 21:37:01] Pranav Cr: she most definitely will
[22/03/22, 21:38:02] Kavana N Murthy: Oh okiess
[22/03/22, 21:38:37] Pranav Cr: ğŸ‘
[22/03/22, 21:39:00] Kavana N Murthy: Is it written or on that quiz app?
[22/03/22, 21:39:57] Pranav Cr: written
[22/03/22, 22:12:23] Kavana N Murthy: What about ops aat
[22/03/22, 22:12:56] Pranav Cr: Yeah?
[22/03/22, 22:13:09] Pranav Cr: Show it to mam whenever she is free
[22/03/22, 22:13:29] Kavana N Murthy: Oh okay
[24/03/22, 12:25:33] Kavana N Murthy: U have Manjula Ma'am number?
[24/03/22, 13:39:57] Pranav Cr: Yeaa
[24/03/22, 13:40:11] Pranav Cr: +91 82962 59916
[26/03/22, 10:26:54] Kavana N Murthy: When is wad
[26/03/22, 10:26:56] Kavana N Murthy: Exam
[26/03/22, 10:29:39] Pranav Cr: Wednesday
[27/03/22, 17:50:40] Kavana N Murthy: Lab how mane Q will be asked?
[27/03/22, 17:50:44] Kavana N Murthy: And how many marks is it
[27/03/22, 18:00:24] Pranav Cr: 2 questions
[27/03/22, 18:00:26] Pranav Cr: 40 marks
[27/03/22, 18:00:42] Kavana N Murthy: Sooo each its 20?
[27/03/22, 18:00:51] Kavana N Murthy: Or she will reduce that 40 M to 20 later
[27/03/22, 18:16:36] Pranav Cr: Yepp
[27/03/22, 18:16:42] Pranav Cr: 40 reduced to 20
[27/03/22, 19:12:59] Kavana N Murthy: 4.Write HTML files and JavaScript scripts for input of line of text using prompt. Generate the
output as the words of the input text in alphabetical order.
[27/03/22, 19:13:04] Kavana N Murthy: do uk this?
[27/03/22, 19:13:23] Pranav Cr: Nope.. I'm still doing php
[27/03/22, 19:13:40] Kavana N Murthy: Oh okay u have the codes for all the PHP lab set?
[27/03/22, 19:22:21] Pranav Cr: Except 5 i have
[27/03/22, 19:22:32] Pranav Cr: Except 5th one
[27/03/22, 19:22:35] Kavana N Murthy: Oh okay can u send me
[27/03/22, 19:23:08] Pranav Cr: Sent to mail
[27/03/22, 19:23:28] Kavana N Murthy: Thanks
[28/03/22, 16:31:17] Kavana N Murthy: Do u have codes for JavaScript and CSS?
[28/03/22, 16:37:56] Pranav Cr: Nope even I'm searching ğŸ¥²
[28/03/22, 19:27:10] Kavana N Murthy: Ayyoo
[28/03/22, 23:05:33] Kavana N Murthy: No Kannada cie?
[28/03/22, 23:07:46] Pranav Cr: Tahts there
[28/03/22, 23:28:45] Kavana N Murthy: Okies
[28/03/22, 23:28:49] Kavana N Murthy: Css u got?
[29/03/22, 09:10:44] Pranav Cr: Noo still doing
[29/03/22, 09:35:52] Pranav Cr: CIE question papers:
https://drive.google.com/folderview?id=134NixYJTI28oKyX6xFfpIoF97S87igw4

Study material:
https://linktr.ee/Bmsceise23
[29/03/22, 09:35:52] Pranav Cr: Under study materials go to materials and then wad and u will get everything
[29/03/22, 09:56:16] Kavana N Murthy: Oh okay thank you
[29/03/22, 23:25:31] Kavana N Murthy: Math maam number?
â€[30/03/22, 08:11:05] Pranav Cr: â€<attached: 00000837-Vishalakshi Mam Bms.vcf>
[30/03/22, 20:18:19] Kavana N Murthy: Do uk math quiz options?
[30/03/22, 20:19:45] Pranav Cr: Options? I forgot the paper ğŸ¥²
[30/03/22, 20:20:11] Kavana N Murthy: Ayyo it's fine leave
[31/03/22, 19:55:30] Kavana N Murthy: DSC lab test
[31/03/22, 19:55:32] Kavana N Murthy: What time is it
[31/03/22, 19:55:33] Kavana N Murthy: ?)
[31/03/22, 19:55:42] Pranav Cr: 1.30-4.30
[31/03/22, 19:56:17] Kavana N Murthy: Oh okay not morning?
[31/03/22, 19:56:24] Pranav Cr: Nope
[31/03/22, 19:56:29] Kavana N Murthy: Okies
[03/04/22, 23:04:43] Kavana N Murthy: Any idea what time Yogesh sir will be available?
[03/04/22, 23:06:49] Pranav Cr: Not sure . He will be there usually
[03/04/22, 23:12:25] Kavana N Murthy: Oh okay fine
â€[05/04/22, 17:31:32] Kavana N Murthy: 3rd sem time table.pdf â€¢ â€2 pages â€<attached: 00000851-3rd sem time table.pdf>
[05/04/22, 17:31:38] Kavana N Murthy: No sem end
[05/04/22, 17:31:41] Kavana N Murthy: Wad?
[05/04/22, 17:31:56] Pranav Cr: It's there.. since it's a lab exam it'll be announced later
[05/04/22, 17:32:01] Kavana N Murthy: Oh okay
[06/04/22, 19:14:56] Kavana N Murthy: Listen DSC lab the first program is only from part A set no
[06/04/22, 19:15:00] Kavana N Murthy: Among those 9?
[06/04/22, 19:20:40] Pranav Cr: Yea and ij between there was postfix evaluation
[06/04/22, 19:22:53] Kavana N Murthy: She won't give modification no
[06/04/22, 19:28:28] Pranav Cr: Oh she will
[06/04/22, 19:28:32] Pranav Cr: That's what I told ryt
[06/04/22, 19:28:39] Pranav Cr: Second program can be anything
[06/04/22, 19:28:53] Kavana N Murthy: Yes yes that's fine I asked the first one
[06/04/22, 19:30:00] Pranav Cr: Yeah only program
[08/04/22, 15:19:23] Kavana N Murthy: Only tutorial 4?
[08/04/22, 15:24:26] Pranav Cr: 4-8 all of em
[08/04/22, 15:57:47] Kavana N Murthy: Oh okay
[08/04/22, 17:51:30] Kavana N Murthy: Where should we submit
[08/04/22, 17:51:32] Kavana N Murthy: Ii?
[08/04/22, 17:54:55] Kavana N Murthy: The aat*
[08/04/22, 18:21:03] Pranav Cr: I'll ask mam tomorrow and tell you?
[08/04/22, 18:29:24] Kavana N Murthy: Haan okay
[08/04/22, 18:53:43] Kavana N Murthy: Can u send drive for this coa ppt
[08/04/22, 18:55:12] Pranav Cr: Yea okay
[08/04/22, 18:56:30] Pranav Cr: https://drive.google.com/drive/folders/1QfjgjFwinL4Dk9CBIi1drRI7WMY911v6
[08/04/22, 18:57:51] Kavana N Murthy: Thank you
[08/04/22, 18:58:10] Pranav Cr: ğŸ‘
[13/04/22, 12:23:55] Kavana N Murthy: Math u need to sign anything?
[13/04/22, 12:30:38] Pranav Cr: Yea bro but mam isn't there
[13/04/22, 12:32:26] Kavana N Murthy: Oh okay what time she will be there?
[13/04/22, 13:31:37] Pranav Cr: Saturday only
[17/04/22, 12:52:01] Kavana N Murthy: Do you have math unit 5 notes?
[17/04/22, 12:55:24] Kavana N Murthy: Thank you
[17/04/22, 12:55:27] Kavana N Murthy: This much is enough no?
[17/04/22, 12:55:54] Pranav Cr: Yea also solve questions from qb
[17/04/22, 12:56:01] Kavana N Murthy: Haan okay
[17/04/22, 12:56:10] Kavana N Murthy: Where is the Qb?
[17/04/22, 12:56:25] Pranav Cr: In the drive link
[17/04/22, 12:56:40] Kavana N Murthy: Oh okay
[19/04/22, 19:41:12] Kavana N Murthy: U have this wad new pdf
[19/04/22, 19:41:12] Kavana N Murthy: Codes?
[19/04/22, 19:42:12] Pranav Cr: NooğŸ¥²
[19/04/22, 19:43:33] Kavana N Murthy: Ayyo it's so hard how do we do all of itğŸ˜©
[19/04/22, 19:43:52] Pranav Cr: Ikr so many unknown concepts ğŸ¥²
[19/04/22, 19:44:43] Kavana N Murthy: ExactlyğŸ˜©
[19/04/22, 19:45:13] Pranav Cr: ğŸ¥²
[19/04/22, 19:45:20] Pranav Cr: Do send if you get any codes
[19/04/22, 19:45:48] Kavana N Murthy: Haan okies if I get I'll send u
[19/04/22, 19:46:39] Pranav Cr: Thankss
â€[19/04/22, 22:27:30] Kavana N Murthy: WAD.docx â€<attached: 00000901-WAD.docx>
[19/04/22, 22:29:50] Pranav Cr: Thankss!
[19/04/22, 22:30:03] Kavana N Murthy: Will we have internet access?
[19/04/22, 22:30:17] Pranav Cr: Yeah ig so because it's in lab 502
[19/04/22, 22:30:19] Pranav Cr: And 503
[19/04/22, 22:30:40] Kavana N Murthy: Oh okay
[19/04/22, 22:30:46] Kavana N Murthy: 40 in one lab no?
[19/04/22, 22:30:54] Pranav Cr: Yeahh
[19/04/22, 22:31:06] Kavana N Murthy: Then ig it's kinda fine
[19/04/22, 22:31:10] Kavana N Murthy: But external it depends
[19/04/22, 22:32:17] Pranav Cr: External is gonna be strict
[19/04/22, 22:32:36] Kavana N Murthy: Yeah? From our dept only or other clg?
[19/04/22, 22:32:54] Pranav Cr: From other college..
[19/04/22, 22:33:14] Kavana N Murthy: Oh okay
[20/04/22, 11:30:49] Kavana N Murthy: 25. Demonstrate onload and onunload
26. Demonstrate hover and focus pseudo elements.
27. Write a Java script code to validate phone number
28. Demonstrate OnClick event and Ondblclick
29. Demonstrate onmousedown and onmouseover
30.A. Demonstrate addEventListener() and removeEventListener() method.
B. Design a webpage to demonstrate CSS animations.
[20/04/22, 11:30:49] Kavana N Murthy: 38. Write a Java script to prompt for users name and display it on the screen.
[20/04/22, 11:33:34] Pranav Cr: ğŸ‘€ğŸ¥²?
[20/04/22, 11:34:52] Kavana N Murthy: If you get anyğŸ¥ºğŸ˜‚ Serbs
[20/04/22, 11:34:53] Kavana N Murthy: Send*
[20/04/22, 11:35:18] Pranav Cr: Okay ğŸ¥²
[20/04/22, 20:03:44] Kavana N Murthy: Is it for 50 or 100M?
[20/04/22, 20:05:03] Pranav Cr: 50 M
[20/04/22, 20:11:51] Kavana N Murthy: Thank you
[21/04/22, 20:10:14] Kavana N Murthy: We have raid and all in mass storage?
[21/04/22, 20:21:30] Pranav Cr: No no
[21/04/22, 20:24:21] Kavana N Murthy: So till disk scheduling it's the end no
[21/04/22, 20:25:18] Pranav Cr: Even file access and Linux case study is there
[21/04/22, 20:26:23] Kavana N Murthy: She has uploaded files right?
[21/04/22, 20:26:25] Kavana N Murthy: Not Linux no
[21/04/22, 20:26:38] Pranav Cr: Yeah ig
[21/04/22, 20:27:57] Kavana N Murthy: Okies
[21/04/22, 20:28:04] Kavana N Murthy: If u have Linux case study send
[21/04/22, 20:28:27] Pranav Cr: Study that from dino text book itself
[21/04/22, 20:28:59] Kavana N Murthy: Oh okay fine
â€[23/04/22, 13:19:08] Kavana N Murthy: â€<attached: 00000935-PHOTO-2022-04-23-13-19-08.jpg>
â€[23/04/22, 13:19:08] Kavana N Murthy: â€<attached: 00000936-PHOTO-2022-04-23-13-19-08.jpg>
â€[23/04/22, 13:19:08] Kavana N Murthy: â€<attached: 00000937-PHOTO-2022-04-23-13-19-08.jpg>
[23/04/22, 13:19:08] Kavana N Murthy: Why they took a32 only?
[23/04/22, 13:19:08] Kavana N Murthy: Or third row in everything?
[23/04/22, 13:21:01] Pranav Cr: Actually you should multiply initial probability vector
[23/04/22, 13:21:07] Pranav Cr: Then you'll get the row
[23/04/22, 13:32:31] Kavana N Murthy: Oh okay
â€[23/04/22, 22:32:08] Kavana N Murthy: â€<attached: 00000943-PHOTO-2022-04-23-22-32-08.jpg>
[23/04/22, 22:32:19] Kavana N Murthy: Could u tell me the answers for first one
â€[23/04/22, 22:51:12] Pranav Cr: â€<attached: 00000945-PHOTO-2022-04-23-22-51-12.jpg>
[23/04/22, 22:51:16] Pranav Cr: I'm not sure abt the ans..
[23/04/22, 22:57:19] Kavana N Murthy: Oh okay thank you
â€[24/04/22, 13:44:29] Kavana N Murthy: â€<attached: 00000949-PHOTO-2022-04-24-13-44-29.jpg>
â€[24/04/22, 13:49:48] Pranav Cr: â€<attached: 00000950-PHOTO-2022-04-24-13-49-48.jpg>
â€[24/04/22, 13:50:02] Pranav Cr: â€<attached: 00000951-PHOTO-2022-04-24-13-50-02.jpg>
â€[24/04/22, 13:50:09] Pranav Cr: â€<attached: 00000952-PHOTO-2022-04-24-13-50-09.jpg>
[24/04/22, 13:50:37] Kavana N Murthy: Thank you
[24/04/22, 13:53:47] Pranav Cr: ğŸ‘
[24/04/22, 18:00:09] Pranav Cr: Here m=5, sorry mistake
[26/04/22, 00:15:41] Kavana N Murthy: â€You deleted this message.
â€[26/04/22, 00:30:01] Kavana N Murthy: â€<attached: 00000957-PHOTO-2022-04-26-00-30-00.jpg>
[26/04/22, 00:30:03] Kavana N Murthy: C
[26/04/22, 09:02:25] Pranav Cr: No clueğŸ¥²
â€[26/04/22, 15:59:31] Kavana N Murthy: â€<attached: 00000960-PHOTO-2022-04-26-15-59-31.jpg>
[26/04/22, 16:03:02] Kavana N Murthy: Is 1a
[26/04/22, 16:03:02] Kavana N Murthy: Client server
[26/04/22, 16:04:43] Pranav Cr: Yeahh
â€[26/04/22, 19:27:59] Kavana N Murthy: â€<attached: 00000964-PHOTO-2022-04-26-19-27-59.jpg>
[26/04/22, 19:28:06] Kavana N Murthy: B
[26/04/22, 19:29:22] Pranav Cr: I'm not sure wther this is d ans
â€[26/04/22, 19:29:28] Pranav Cr: â€<attached: 00000967-PHOTO-2022-04-26-19-29-28.jpg>
[26/04/22, 19:36:40] Kavana N Murthy: Oh Olaf
[26/04/22, 19:36:42] Kavana N Murthy: Okay*
â€[26/04/22, 22:25:49] Kavana N Murthy: â€<attached: 00000970-PHOTO-2022-04-26-22-25-48.jpg>
[26/04/22, 22:25:57] Kavana N Murthy: Without arrival time
[26/04/22, 22:26:00] Kavana N Murthy: How do u do
[26/04/22, 22:26:01] Kavana N Murthy: Fcfs
[26/04/22, 22:26:16] Pranav Cr: Same order
[26/04/22, 22:27:29] Kavana N Murthy: Oh okay
â€[26/04/22, 22:27:35] Kavana N Murthy: â€<attached: 00000976-PHOTO-2022-04-26-22-27-34.jpg>
[26/04/22, 22:28:06] Kavana N Murthy: This how did they do
[26/04/22, 22:28:22] Pranav Cr: fcfs
[26/04/22, 22:28:24] Pranav Cr: order only
[26/04/22, 22:28:37] Kavana N Murthy: Why they stopped at 2?
[26/04/22, 22:29:30] Pranav Cr: must be atyping mistake
â€[26/04/22, 22:31:31] Kavana N Murthy: â€<attached: 00000982-PHOTO-2022-04-26-22-31-31.jpg>
[26/04/22, 22:31:38] Kavana N Murthy: Is this right?
[26/04/22, 22:31:47] Pranav Cr: Yeah
[26/04/22, 22:33:04] Kavana N Murthy: How do u calculate WT for this?
[26/04/22, 22:33:29] Pranav Cr: Turn around time-burst tine
[26/04/22, 22:33:56] Kavana N Murthy: In this Q TAT how we will do without Arrival time?
[26/04/22, 22:34:08] Pranav Cr: Arrival time is 0
[26/04/22, 22:34:16] Kavana N Murthy: For all the process?
[26/04/22, 22:34:39] Kavana N Murthy: We consider 0?
[26/04/22, 22:35:47] Pranav Cr: yesss
[26/04/22, 22:35:54] Kavana N Murthy: Okies thank you
â€[27/04/22, 01:04:15] Kavana N Murthy: â€<attached: 00000993-PHOTO-2022-04-27-01-04-15.jpg>
[27/04/22, 01:04:15] Kavana N Murthy: https://youtu.be/2H3QJeVWzQM
[27/04/22, 01:04:15] Kavana N Murthy: Why partition in that
[27/04/22, 01:04:15] Kavana N Murthy: And not this?
[27/04/22, 07:55:12] Pranav Cr: Because this is holes and variable
[27/04/22, 11:26:11] Kavana N Murthy: U mean if it's shaded like that we have to do?
[27/04/22, 11:49:13] Pranav Cr: Yeahh
[27/04/22, 21:15:54] Kavana N Murthy: What are the topics for unit 5 to study
[27/04/22, 21:16:20] Pranav Cr: Code for only avl insertion
[27/04/22, 21:16:24] Pranav Cr: Rest all solving
[27/04/22, 21:16:43] Kavana N Murthy: Oh okay
â€[28/04/22, 21:20:01] Kavana N Murthy: â€<attached: 00001004-PHOTO-2022-04-28-21-20-01.jpg>
[28/04/22, 21:20:01] Kavana N Murthy: How u will put 6
[28/04/22, 21:20:04] Kavana N Murthy: It's full no
[28/04/22, 21:20:06] Kavana N Murthy: Queue
[28/04/22, 21:20:20] Pranav Cr: Indicate it's full
[28/04/22, 21:21:15] Kavana N Murthy: So then 6 won't be in queue we directly start deleting?
[28/04/22, 21:21:28] Pranav Cr: yeah\
[28/04/22, 21:22:13] Kavana N Murthy: Thank you
[28/04/22, 21:29:28] Kavana N Murthy: A singly linked list containing both positive numbers and negative
numbers is given. Use this linked list and write a C routine to create two
singly linked lists (with header nodes), one containing all positive
numbers and the other containing negative numbers. Print the resulting
lists.
[28/04/22, 21:29:59] Pranav Cr: split to two LL
â€[28/04/22, 21:30:24] Kavana N Murthy: â€<attached: 00001014-PHOTO-2022-04-28-21-30-24.jpg>
[28/04/22, 21:30:31] Kavana N Murthy: Oh okiess and this one
[28/04/22, 21:30:40] Pranav Cr: middle character in a string
[28/04/22, 21:31:01] Kavana N Murthy: Oh okay
â€[30/04/22, 19:33:30] Kavana N Murthy: â€<attached: 00001018-PHOTO-2022-04-30-19-33-29.jpg>
[30/04/22, 19:33:30] Kavana N Murthy: Do u have notes for this?
[30/04/22, 19:37:37] Pranav Cr: Nope mam sent video no for last unit
[02/05/22, 16:42:01] Kavana N Murthy: â€You deleted this message.
[02/05/22, 16:42:06] Kavana N Murthy: â€You deleted this message.
[02/05/22, 16:42:09] Kavana N Murthy: Could u solve
â€[02/05/22, 16:42:50] Kavana N Murthy: â€<attached: 00001024-PHOTO-2022-05-02-16-42-50.jpg>
[02/05/22, 16:42:57] Kavana N Murthy: 1a and 1c in this
[02/05/22, 16:47:08] Pranav Cr: I haven't done unit 1 yet I'll study and send later
[02/05/22, 16:47:19] Kavana N Murthy: Haan okay
[02/05/22, 16:47:29] Pranav Cr: 1 c must be in PPT
[02/05/22, 16:47:37] Kavana N Murthy: Yeah I got 1c
[02/05/22, 16:47:41] Kavana N Murthy: 1a tell me when u get it
[02/05/22, 16:47:52] Pranav Cr: Okk
[02/05/22, 17:21:05] Kavana N Murthy: This unit 2li
[02/05/22, 17:21:05] Kavana N Murthy: For cie 2
[02/05/22, 17:21:05] Kavana N Murthy: We didn't have many things no
[02/05/22, 17:21:05] Kavana N Murthy: It's not there for sem end also?
[02/05/22, 17:21:05] Kavana N Murthy: That last 2ppt
[02/05/22, 17:33:29] Pranav Cr: Yeah
[02/05/22, 17:33:31] Pranav Cr: It is there
[02/05/22, 22:24:37] Kavana N Murthy: That interface circuit and bus no
[02/05/22, 22:26:12] Pranav Cr: Yeah
[02/05/22, 22:27:32] Kavana N Murthy: Okies
[03/05/22, 02:03:32] Kavana N Murthy: Two devices A and B with IDâ€™s 0010 and 0100 are requesting for the usage of bus. Identify the device which gains the bus mastership using an arbitration process and explain the same in detail.
[03/05/22, 08:35:07] Pranav Cr: It's there in PPT
[03/05/22, 08:35:17] Pranav Cr: Distributed bus arbitration
[03/05/22, 11:45:20] Kavana N Murthy: Yeah like u take logical or then
[03/05/22, 12:16:15] Pranav Cr: Yes
[03/05/22, 12:25:12] Kavana N Murthy: After that how Dou do
[03/05/22, 12:25:47] Pranav Cr: Compare from msb with Or'D value
[03/05/22, 12:25:55] Pranav Cr: The device that matches the most is serviced
[03/05/22, 12:29:25] Kavana N Murthy: Oh okay like that
[03/05/22, 13:46:30] Kavana N Murthy: )Design an 4-bit carry look-ahead adder and identify the number of delays for carry bits and sum bits
[03/05/22, 13:48:15] Pranav Cr: This is there in ppt
[03/05/22, 13:48:38] Kavana N Murthy: Which one are we supposed to write
[03/05/22, 13:48:47] Pranav Cr: Carry look ahead
[03/05/22, 13:49:38] Kavana N Murthy: Oh okay thank you
[03/05/22, 22:37:50] Kavana N Murthy: Explain the hardware organization and instruction execution for a 4-stage
pipelined processor
[03/05/22, 22:37:50] Kavana N Murthy: It's that fetch decode execute write v
[03/05/22, 22:37:50] Kavana N Murthy: ??
[04/05/22, 08:55:46] Pranav Cr: Yeahhh
â€[04/05/22, 20:10:30] Kavana N Murthy: â€<attached: 00001061-PHOTO-2022-05-04-20-10-30.jpg>
[04/05/22, 20:10:41] Kavana N Murthy: Do uk 1a in this?
[04/05/22, 20:11:00] Pranav Cr: Page 11 textbook
[04/05/22, 20:11:01] Pranav Cr: Last paragraph
[04/05/22, 20:11:26] Kavana N Murthy: Could u send the PDF if u have?
[04/05/22, 20:17:59] Kavana N Murthy: Thanks
[04/05/22, 21:38:51] Pranav Cr: ğŸ‘
â€[06/05/22, 14:23:29] Kavana N Murthy: â€<attached: 00001069-PHOTO-2022-05-06-14-23-29.jpg>
[06/05/22, 14:23:29] Kavana N Murthy: Is this correct?
[06/05/22, 14:24:47] Pranav Cr: I'll solve and tell?
[06/05/22, 14:25:06] Kavana N Murthy: Haan okay
â€[06/05/22, 16:15:10] Kavana N Murthy: â€<attached: 00001073-PHOTO-2022-05-06-16-15-10.jpg>
[06/05/22, 16:15:10] Kavana N Murthy: 1b
[06/05/22, 16:15:10] Kavana N Murthy: We should put 0 in the boxes for the values they give??
[06/05/22, 16:21:10] Pranav Cr: No no
[06/05/22, 16:21:14] Pranav Cr: 1 in which they gave
[06/05/22, 16:21:18] Pranav Cr: 0 in which they didnt
[06/05/22, 16:21:44] Kavana N Murthy: Then circle the 0's?
[06/05/22, 16:21:47] Kavana N Murthy: For pos
[06/05/22, 16:21:49] Kavana N Murthy: Right
[06/05/22, 16:21:57] Pranav Cr: Yuss
[06/05/22, 16:22:05] Kavana N Murthy: Okies thank you
[06/05/22, 16:24:11] Pranav Cr: ğŸ‘
[06/05/22, 19:01:03] Kavana N Murthy: Implement the following functions using a 3:8 decoder minimizing the
number of inputs to be summed.
f1 (a,b,c) = âˆ‘ m (0,2,3,5,6,7)
f2 (a,b,c) = âˆ‘ m (1,3,4,6,7)
[06/05/22, 19:01:03] Kavana N Murthy: Which gate should we use?
[06/05/22, 19:37:46] Pranav Cr: NOR
[06/05/22, 19:37:49] Pranav Cr: They told minimum
[06/05/22, 19:44:42] Kavana N Murthy: Oh okay
[06/05/22, 19:44:43] Kavana N Murthy: Thank you
[06/05/22, 21:24:37] Kavana N Murthy: Listen we have positive edge trigerring and all?
[06/05/22, 21:25:14] Kavana N Murthy: Also analysis of sequential circuit is only for SR?
[06/05/22, 21:25:27] Pranav Cr: Yeah
[06/05/22, 21:25:31] Pranav Cr: No no any FF
[06/05/22, 21:25:43] Kavana N Murthy: Oh okay Qp it was only SR no that's why
[06/05/22, 21:25:54] Pranav Cr: Ohh anything will come
[06/05/22, 21:26:32] Kavana N Murthy: And this only D and T?
[06/05/22, 22:38:17] Pranav Cr: JK and SR also
â€[07/05/22, 00:15:34] Kavana N Murthy: â€<attached: 00001099-PHOTO-2022-05-07-00-15-34.jpg>
[07/05/22, 07:31:59] Pranav Cr: Yeah direct only no
[07/05/22, 11:01:43] Kavana N Murthy: Like?
[07/05/22, 11:08:39] Pranav Cr: Analysis of circuit
[07/05/22, 11:08:44] Pranav Cr: Find S and R for each FF
[09/05/22, 02:04:10] Kavana N Murthy: Dou have notes for unit 4/5
[09/05/22, 02:04:12] Kavana N Murthy: Oops
[09/05/22, 08:46:59] Pranav Cr: Nope ppt only
[09/05/22, 11:16:54] Kavana N Murthy: For unit 5 she put?
[09/05/22, 11:17:52] Pranav Cr: Yeah
[09/05/22, 11:18:10] Kavana N Murthy: Can u tell me which all
[09/05/22, 11:18:27] Pranav Cr: Unit 5?
[09/05/22, 11:18:31] Kavana N Murthy: Yes
[09/05/22, 11:18:36] Pranav Cr: Programs on STL
[09/05/22, 11:18:47] Pranav Cr: Exception programs
[09/05/22, 11:18:49] Pranav Cr: Exceptions
[09/05/22, 11:19:41] Kavana N Murthy: Oh okay got it
[09/05/22, 11:20:38] Pranav Cr: Templates
[09/05/22, 13:28:54] Kavana N Murthy: Details of Students
USN NAME SEM CGPA
101 Suresh 3 8.7
102 Mukesh 4 9.8
103 Ramesh 6 7.8
Develop a program to obtain the above given output by taking suitable
input from the user.
[09/05/22, 13:34:59] Pranav Cr: Array of objects
[09/05/22, 13:35:08] Pranav Cr: Or directly also is fine
[09/05/22, 16:13:46] Kavana N Murthy: d) int main()
{
example e1(5,2) ;
cout << endl <<"E1 Object: " << endl;
cout << "Value after initialization : " ;
e1.Display();
example e2 = example(e1);
cout << endl << "E2 Object: " << endl;
cout << "Value after initialization : ";
e2.Display();
return 0;
}
Complete the given snippet
[09/05/22, 16:13:46] Kavana N Murthy: How do u do this?write class example with default and parameter and copy contrcutor?
[09/05/22, 16:13:46] Kavana N Murthy: constructor*
[09/05/22, 16:13:52] Kavana N Murthy: oh okies
[09/05/22, 16:16:03] Kavana N Murthy: What is the risk of giving default values for
the overloaded member function?
[09/05/22, 16:22:45] Pranav Cr: Yeah it's better you write all constrictors.. you won't lose marks
[09/05/22, 16:22:52] Kavana N Murthy: Haan okay
[09/05/22, 16:23:22] Pranav Cr: Ambiguity
[09/05/22, 23:40:52] Kavana N Murthy: Thank you
[10/05/22, 21:55:12] Kavana N Murthy: What English
[10/05/22, 21:55:14] Kavana N Murthy: ğŸ˜‚ğŸ˜‚
[10/05/22, 21:55:36] Pranav Cr: Ayy sir it wasğŸ˜‚
[10/05/22, 21:56:14] Kavana N Murthy: Waste guy onlyğŸ˜‚
[10/05/22, 21:56:52] Pranav Cr: ğŸ˜‚ğŸ˜‚
[11/05/22, 16:16:29] Kavana N Murthy: Can u send all the evs
[11/05/22, 16:16:31] Kavana N Murthy: ppts
â€[11/05/22, 16:17:12] Pranav Cr: EVS-UNIT 2-Energy resources-additional(1).pdf â€¢ â€31 pages â€<attached: 00001140-EVS-UNIT 2-Energy resources-additional(1).pdf>
â€[11/05/22, 16:17:12] Pranav Cr: Unit 4-current env. issues.pptx â€<attached: 00001141-Unit 4-current env. issues.pptx>
[11/05/22, 16:17:31] Kavana N Murthy: Thank you only these?
[11/05/22, 16:17:39] Pranav Cr: Yeah 4 units
[11/05/22, 19:01:08] Kavana N Murthy: okies
[11/05/22, 23:08:12] Kavana N Murthy: Do u have calendar for the next sem?
[12/05/22, 08:30:24] Pranav Cr: Nope
[14/05/22, 13:05:11] Pranav Cr: In ec office
[14/05/22, 13:05:32] Pranav Cr: ğŸ˜‚exam done so u left it?
[14/05/22, 14:23:17] Kavana N Murthy: Oh yeahğŸ˜‚ğŸ˜‚
[14/05/22, 14:23:20] Kavana N Murthy: I didn't realise only
[14/05/22, 14:24:18] Pranav Cr: ğŸ˜‚ğŸ˜‚ğŸ˜‚ğŸ˜‚
[17/05/22, 18:39:24] Kavana N Murthy: We have classes tomorrow
[17/05/22, 18:39:25] Kavana N Murthy: ?
[17/05/22, 19:21:22] Pranav Cr: Yes yes
[17/05/22, 20:15:51] Kavana N Murthy: Lab also?
[17/05/22, 20:16:55] Pranav Cr: No lab tomorrow no
[17/05/22, 20:17:09] Kavana N Murthy: So first week no lab?
[17/05/22, 20:17:23] Pranav Cr: Not like that
[17/05/22, 20:17:27] Pranav Cr: There's no lab in d TR
[17/05/22, 20:17:28] Pranav Cr: TT
[17/05/22, 20:18:31] Kavana N Murthy: Why it's in yellow
[17/05/22, 20:18:44] Pranav Cr: Indicated it's a change in faculty
[17/05/22, 20:18:52] Kavana N Murthy: Oh okay
[17/05/22, 20:18:56] Kavana N Murthy: So class till 1 tomorrow?
[17/05/22, 20:19:11] Pranav Cr: Ayy no why are you getting confused
[17/05/22, 20:19:15] Kavana N Murthy: ğŸ¥ºğŸ˜‚
[17/05/22, 20:19:18] Kavana N Murthy: I thought lab is there
[17/05/22, 20:19:30] Pranav Cr: ğŸ˜‚ğŸ˜‚ğŸ˜‚ha no
[17/05/22, 20:20:01] Kavana N Murthy: Oh shit
[17/05/22, 20:20:04] Kavana N Murthy: I thought it's Monday
[17/05/22, 20:20:06] Kavana N Murthy: TomğŸ˜‚ğŸ¤¦ğŸ»â€â™€ï¸
[17/05/22, 20:20:30] Pranav Cr: ğŸ˜‚ğŸ˜‚ğŸ˜‚ğŸ˜‚ğŸ˜‚ğŸ˜‚ amazing
[17/05/22, 20:22:48] Kavana N Murthy: ğŸ˜‚ğŸ˜‚ğŸ˜‚
[19/05/22, 13:09:20] Kavana N Murthy: TFC is at 2 Or3?
[19/05/22, 23:04:44] Kavana N Murthy: Can u Send today's notes
[19/05/22, 23:04:46] Kavana N Murthy: Tfc
[19/05/22, 23:10:42] Pranav Cr: Ha yeahh 2 mins
â€[19/05/22, 23:13:41] Pranav Cr: â€<attached: 00001181-PHOTO-2022-05-19-23-13-41.jpg>
â€[19/05/22, 23:13:53] Pranav Cr: â€<attached: 00001182-PHOTO-2022-05-19-23-13-53.jpg>
[19/05/22, 23:14:09] Kavana N Murthy: Thank you
[22/05/22, 22:20:16] Kavana N Murthy: We have classes tomorrow?
[22/05/22, 22:20:50] Pranav Cr: Yea we doi
[22/05/22, 22:20:51] Pranav Cr: Do*
[22/05/22, 22:21:03] Kavana N Murthy: I thought miss match day they wouldn't keepğŸ¥ºğŸ˜‚
[22/05/22, 22:21:36] Pranav Cr: Ohho that and all won't happen ğŸ˜‚
[24/05/22, 21:26:04] Kavana N Murthy: Tomo only uhğŸ˜ğŸ˜‚
[24/05/22, 21:26:22] Pranav Cr: 70% probability
[24/05/22, 21:26:22] Pranav Cr: ğŸ˜‚
[24/05/22, 21:26:29] Kavana N Murthy: DamnğŸ˜‚
[24/05/22, 21:26:38] Kavana N Murthy: Sudden shock these ppl will give
[24/05/22, 21:26:55] Pranav Cr: They already released IEM and CV results
[24/05/22, 21:27:09] Kavana N Murthy: Yeah I just saw today cv came no
[24/05/22, 21:27:22] Pranav Cr: Yeahh that too in the middle of movie dayğŸ˜¶
[24/05/22, 21:32:04] Kavana N Murthy: Fuck mad onlyğŸ˜‚I thought it was in the evening
[24/05/22, 21:32:27] Pranav Cr: Bms never fails to surprise ğŸ˜‚
[24/05/22, 22:04:03] Kavana N Murthy: TrueğŸ˜‚
[25/05/22, 18:41:49] Kavana N Murthy: What's this smi groups?
[25/05/22, 18:43:33] Pranav Cr: seminar we should do in groups
[25/05/22, 18:44:53] Kavana N Murthy: Oh okay
[26/05/22, 12:25:59] Kavana N Murthy: What time will they announce
[26/05/22, 12:36:36] Pranav Cr: By EOD
[26/05/22, 12:36:58] Kavana N Murthy: What's eod?ğŸ˜‚
[26/05/22, 12:37:12] Pranav Cr: End of dayğŸ˜‚
[26/05/22, 12:37:24] Kavana N Murthy: Pakka today only?ğŸ˜‚
[26/05/22, 12:38:06] Pranav Cr: Yes yesğŸ˜‚
[26/05/22, 17:28:19] Kavana N Murthy: Not againğŸ˜‚ğŸ˜©
[26/05/22, 17:28:39] Pranav Cr: They just don't want to announce ğŸ˜‚ğŸ˜‚
[26/05/22, 17:28:56] Kavana N Murthy: That's what mech they just put up now noğŸ˜‚
[26/05/22, 17:30:05] Pranav Cr: Yeah for some reason coe doesn't like ISEğŸ˜‚
[26/05/22, 17:30:22] Kavana N Murthy: Maybe they are like so soonğŸ˜‚ they gave off this time
[26/05/22, 17:30:32] Kavana N Murthy: But if it's easy why aren't they putting it up
[26/05/22, 17:30:37] Kavana N Murthy: Atleast Tom they will?
[26/05/22, 17:30:57] Pranav Cr: ğŸ˜‚ğŸ˜‚ğŸ˜‚yeaj
[26/05/22, 17:31:03] Pranav Cr: Actually verification is going on
[26/05/22, 17:31:09] Pranav Cr: Yepp hope so
[26/05/22, 17:31:16] Kavana N Murthy: Oh okay like that
[26/05/22, 17:31:18] Kavana N Murthy: I hope so then
[26/05/22, 17:32:10] Pranav Cr: Yeahh
[29/05/22, 16:39:39] Kavana N Murthy: Never ending that isğŸ˜‚
[29/05/22, 16:41:27] Pranav Cr: IkrğŸ˜‚ğŸ˜‚
[29/05/22, 16:41:41] Pranav Cr: Just so that ppl don't go into full jolly mode
[29/05/22, 20:21:02] Kavana N Murthy: Papa that isğŸ˜‚
[29/05/22, 20:40:23] Pranav Cr: ğŸ˜‚ğŸ˜‚
[01/06/22, 17:47:24] Kavana N Murthy: U have that cgpa
[01/06/22, 17:47:26] Kavana N Murthy: Calculator
[01/06/22, 17:47:27] Kavana N Murthy: ?
[01/06/22, 17:49:48] Pranav Cr: No no but ik the formula
[01/06/22, 17:50:40] Kavana N Murthy: Could u tell
[01/06/22, 17:52:16] Pranav Cr: Product of grade point and credits/total credits
[01/06/22, 18:16:52] Kavana N Murthy: Oh okay thank you
[06/06/22, 19:30:51] Kavana N Murthy: One period what lab she will do
[06/06/22, 19:30:53] Kavana N Murthy: ğŸ˜©
[06/06/22, 19:35:38] Pranav Cr: ğŸ˜¶ğŸ˜¶don't know
[06/06/22, 19:35:44] Pranav Cr: But she won't take much time ig
[06/06/22, 19:35:59] Kavana N Murthy: She could give us free hour noğŸ˜‚ğŸ¤¦ğŸ»â€â™€ï¸
[06/06/22, 19:37:10] Pranav Cr: ğŸ¤£ğŸ¤£ğŸ¤£she wont do that and all
[06/06/22, 19:37:28] Kavana N Murthy: It's not even her period
[06/06/22, 19:37:33] Kavana N Murthy: Like that Java ladyğŸ˜‚ğŸ˜‚
[06/06/22, 19:37:36] Kavana N Murthy: Coming for every class
[06/06/22, 19:37:38] Kavana N Murthy: She can get
[06/06/22, 19:37:41] Kavana N Murthy: And won't do shit
[06/06/22, 19:37:59] Pranav Cr: ğŸ¥²ğŸ¥²ğŸ¥²what to do
[06/06/22, 19:38:13] Kavana N Murthy: If she teaches like thisğŸ˜µ
[06/06/22, 19:38:16] Kavana N Murthy: What to do
[06/06/22, 19:39:24] Kavana N Murthy: Will she take attendance USP?
[06/06/22, 19:39:38] Pranav Cr: java or usp??
[06/06/22, 19:39:44] Pranav Cr: definitely
[06/06/22, 19:39:49] Kavana N Murthy: Java
[06/06/22, 19:40:11] Pranav Cr: ayyo no clue only i have to discuss with nandan and decide..
[06/06/22, 19:40:21] Kavana N Murthy: Haan okies
[06/06/22, 19:40:29] Kavana N Murthy: Shubha Ma'am was sm better
[06/06/22, 19:40:54] Pranav Cr: yea but they have given 2 subjects for her thats the prob
[06/06/22, 19:41:08] Kavana N Murthy: Oh like that
[06/06/22, 19:43:05] Pranav Cr: yeaa
[06/06/22, 20:40:07] Kavana N Murthy: Who is
[06/06/22, 20:40:08] Kavana N Murthy: Vsr
[06/06/22, 20:40:11] Kavana N Murthy: In that Java lab?
[06/06/22, 20:43:17] Pranav Cr: Shubha mam
[06/06/22, 20:43:37] Pranav Cr: There's no VSR IN TT no
[06/06/22, 20:44:03] Kavana N Murthy: Oh yeah I was seeing the other one
[06/06/22, 20:44:14] Pranav Cr: Ah aight
[09/06/22, 19:47:32] Kavana N Murthy: Guys complete the observation include the following things;
1. Program code
2. Input table
3. Time analysis with graph
4. Comparison with theoretical graph
[09/06/22, 19:47:37] Kavana N Murthy: Have u written?
[09/06/22, 19:57:39] Pranav Cr: I have but idk whether it's right
[09/06/22, 20:01:23] Kavana N Murthy: Just send no
[09/06/22, 20:01:45] Pranav Cr: Write diff values for time and graph
â€[09/06/22, 20:01:56] Pranav Cr: â€<attached: 00001270-PHOTO-2022-06-09-20-01-56.jpg>
â€[09/06/22, 20:01:57] Pranav Cr: â€<attached: 00001271-PHOTO-2022-06-09-20-01-57.jpg>
â€[09/06/22, 20:01:57] Pranav Cr: â€<attached: 00001272-PHOTO-2022-06-09-20-01-57.jpg>
[09/06/22, 20:02:57] Kavana N Murthy: Thank you
[09/06/22, 20:03:00] Kavana N Murthy: Haan okay
[09/06/22, 22:24:15] Kavana N Murthy: How did u get the Dots above the St line?
[09/06/22, 22:39:59] Pranav Cr: No don't worry abt that
[11/06/22, 10:56:30] Kavana N Murthy: I just came for USP lab
[11/06/22, 10:56:32] Kavana N Murthy: ğŸ¥ºğŸ˜‚ğŸ˜‚
[11/06/22, 10:56:34] Kavana N Murthy: Omg
[11/06/22, 10:56:57] Pranav Cr: Ayyo ğŸ˜¶
[11/06/22, 11:20:58] Kavana N Murthy: Smi compulsory?
[11/06/22, 11:21:08] Pranav Cr: Yess
â€[11/06/22, 13:06:35] Kavana N Murthy: SMI-Batches.xlsx â€¢ â€4 sheets â€<attached: 00001283-SMI-Batches.xlsx>
[11/06/22, 13:06:40] Kavana N Murthy: My name is not there only
[11/06/22, 13:10:32] Pranav Cr: Did you fill?
[11/06/22, 13:11:17] Kavana N Murthy: Yeah I did
â€[11/06/22, 13:12:06] Kavana N Murthy: â€<attached: 00001287-PHOTO-2022-06-11-13-12-06.jpg>
[11/06/22, 13:12:09] Kavana N Murthy: See it's there
[11/06/22, 13:12:52] Pranav Cr: Go where your teammates are there
[11/06/22, 13:16:37] Kavana N Murthy: None of our names are there
[12/06/22, 14:14:15] Kavana N Murthy: WhatğŸ˜‚ğŸ˜
[12/06/22, 14:14:53] Pranav Cr: YeahğŸ¥²ğŸ¥²
[12/06/22, 14:14:57] Pranav Cr: No holiday tomorrow ğŸ¤£
[12/06/22, 14:15:10] Kavana N Murthy: Wasn't it not anyway?ğŸ˜‚ğŸ˜‚
[12/06/22, 14:15:31] Pranav Cr: Ay no there was some election going on so govt declared holiday
[12/06/22, 14:15:43] Pranav Cr: But doesn't apply to BMS
[12/06/22, 14:16:14] Kavana N Murthy: Oh like thatğŸ˜‚
[12/06/22, 14:16:38] Pranav Cr: HaağŸ¤£
[13/06/22, 07:30:39] Pranav Cr: Many many happy returns of the dayyğŸ¥³!
[13/06/22, 08:18:58] Kavana N Murthy: Thank you so much!
[16/06/22, 19:18:19] Kavana N Murthy: USP lab Tom no assessment no?
[16/06/22, 19:18:23] Kavana N Murthy: She didn't inform
[16/06/22, 19:21:35] Pranav Cr: I don't think so but I have asked her to confirm let's see
[16/06/22, 19:31:34] Kavana N Murthy: When is it
[16/06/22, 19:31:41] Kavana N Murthy: Tom?
[16/06/22, 19:31:49] Pranav Cr: Wait no let some suspense be there
[16/06/22, 19:31:51] Pranav Cr: ğŸ¤£
[16/06/22, 19:32:02] Kavana N Murthy: AyyoğŸ˜‚ğŸ˜‚
[16/06/22, 19:33:32] Pranav Cr: Some 10 mins let ppl wonderğŸ¤£
[16/06/22, 19:39:11] Kavana N Murthy: They will freak outğŸ˜‚
[16/06/22, 19:40:23] Pranav Cr: I want thatğŸ¤£ğŸ¤£
[17/06/22, 21:12:59] Kavana N Murthy: Can u send math qb
[17/06/22, 21:25:36] Pranav Cr: It's in the WhatsApp grp
[17/06/22, 21:39:16] Kavana N Murthy: Thank you
[21/06/22, 18:58:41] Kavana N Murthy: 2-4 nothing?
[21/06/22, 18:58:50] Pranav Cr: Nothing
[21/06/22, 18:59:57] Kavana N Murthy: So Lia tutorial as scheduled no
[21/06/22, 19:02:23] Pranav Cr: Yeahh
[23/06/22, 15:44:58] Kavana N Murthy: Tom lab assessment no USP?
[23/06/22, 17:18:10] Pranav Cr: Yeahh it's there
[23/06/22, 18:36:40] Kavana N Murthy: U can copy and all uh
[23/06/22, 18:36:43] Kavana N Murthy: ğŸ˜ğŸ˜‚
[23/06/22, 18:37:00] Pranav Cr: i dont think so mam is very strictğŸ¥²
[23/06/22, 18:38:33] Kavana N Murthy: Ayyo she will give sheets and all uh
[23/06/22, 18:38:39] Pranav Cr: yeahh
[23/06/22, 18:38:47] Kavana N Murthy: Cause in a section it seems only 3/4 commands she told to do that's all
[23/06/22, 18:38:49] Kavana N Murthy: Like simple
[23/06/22, 18:39:03] Pranav Cr: mam wasnt there na
[23/06/22, 18:39:11] Kavana N Murthy: Yeah uh ayo
[23/06/22, 18:39:13] Pranav Cr: our teacher is diferent
[23/06/22, 18:40:12] Kavana N Murthy: Chey
[23/06/22, 18:42:18] Pranav Cr: ğŸ˜¢ğŸ¥²
[23/06/22, 20:25:12] Kavana N Murthy: Please tell me
[23/06/22, 20:25:14] Kavana N Murthy: No test
[23/06/22, 20:25:16] Kavana N Murthy: ğŸ˜©ğŸ˜‚
[23/06/22, 20:25:25] Pranav Cr: No it is 100% there
[23/06/22, 20:25:28] Kavana N Murthy: Chey
[23/06/22, 20:25:32] Kavana N Murthy: What's the suprise then
[23/06/22, 20:26:02] Pranav Cr: Wait for itğŸ¤£
[23/06/22, 20:26:14] Kavana N Murthy: AyyoğŸ˜‚
[23/06/22, 20:31:03] Kavana N Murthy: ğŸ˜ğŸ˜‚
[23/06/22, 20:31:36] Pranav Cr: ğŸ˜‚ğŸ˜‚
[23/06/22, 23:37:44] Kavana N Murthy: She did only one chapter in that tb?
[24/06/22, 07:22:20] Pranav Cr: I'm not sure about textbook refer the notes
[24/06/22, 16:42:23] Kavana N Murthy: Block chain  there Tom?
[24/06/22, 16:43:51] Pranav Cr: I'll ask mam wait
[24/06/22, 16:44:16] Kavana N Murthy: Haan
[24/06/22, 20:55:45] Kavana N Murthy: Won't java class be cancelledğŸ¥ºğŸ˜‚
[24/06/22, 21:02:46] Pranav Cr: Definitely not ğŸ¤£
[24/06/22, 21:04:30] Kavana N Murthy: What we will do from 11-2ğŸ˜‚ğŸ˜
[24/06/22, 21:05:31] Pranav Cr: You can play cricket or badminton ğŸ˜¶
[27/06/22, 17:52:23] Kavana N Murthy: Dou have Qp's for all the subjects CIE?
[27/06/22, 17:52:29] Kavana N Murthy: Only DBMS she put it up no
[27/06/22, 17:52:32] Kavana N Murthy: Rest u have?
[27/06/22, 17:52:41] Kavana N Murthy: It's not the drive
[27/06/22, 17:55:14] Pranav Cr: No no even I'm asking mam told she would send the other subjects as well
[27/06/22, 17:55:29] Kavana N Murthy: Haan okay
[27/06/22, 17:57:41] Kavana N Murthy: Also the portions douk?
[27/06/22, 17:58:52] Pranav Cr: Only Java ik..
[27/06/22, 17:58:54] Pranav Cr: 2 units
[27/06/22, 17:59:22] Kavana N Murthy: Ayyo other subjects?
[27/06/22, 18:00:03] Pranav Cr: Nope idk I'll ask and post it . Many of them haven't been decided yet
[27/06/22, 18:00:17] Kavana N Murthy: Oh okay fine
[28/06/22, 13:23:01] Kavana N Murthy: Ur going to class?
[28/06/22, 13:23:22] Pranav Cr: If no one goes i wont
[28/06/22, 13:34:31] Kavana N Murthy: Text me once
[28/06/22, 13:45:14] Kavana N Murthy: Sopakka no class no?
[28/06/22, 13:49:31] Pranav Cr: Yess
[28/06/22, 19:15:03] Kavana N Murthy: Can u send the last code of Java
[28/06/22, 19:15:05] Kavana N Murthy: With ss
â€[28/06/22, 19:16:21] Pranav Cr: javalab28june.docx â€<attached: 00001372-javalab28june.docx>
[28/06/22, 19:16:58] Kavana N Murthy: Thank you
[28/06/22, 20:17:11] Kavana N Murthy: Which tutorial worksheet we need to do?
[28/06/22, 20:23:55] Pranav Cr: Mam didn't mention no
[28/06/22, 20:24:42] Pranav Cr: We have done everything that mam has uploaded
[28/06/22, 20:25:25] Kavana N Murthy: Yeah that's what
[29/06/22, 19:57:04] Kavana N Murthy: Dou have algorithm for that krushkals and the other one
[29/06/22, 19:57:07] Kavana N Murthy: ?? I'm
[29/06/22, 19:57:10] Kavana N Murthy: *
[29/06/22, 19:57:12] Kavana N Murthy: Notes for that
[29/06/22, 19:57:29] Pranav Cr: Sir hadn't done kruskal algorithm in class
[29/06/22, 19:57:44] Kavana N Murthy: But it's there for the test?
[29/06/22, 19:57:59] Pranav Cr: Yeah he'll do it in next class i think
[29/06/22, 19:58:04] Kavana N Murthy: Oh okay fine
[30/06/22, 21:34:16] Kavana N Murthy: Math DBMS portions?
[30/06/22, 21:34:30] Pranav Cr: hasnt been decided yet
[30/06/22, 21:37:01] Kavana N Murthy: Oh okay
[01/07/22, 19:26:32] Kavana N Murthy: Ayyo all of them?
[01/07/22, 19:26:57] Pranav Cr: Sii
[03/07/22, 20:57:49] Kavana N Murthy: What's tbv
[03/07/22, 20:57:51] Kavana N Murthy: Tbc
[03/07/22, 20:58:32] Pranav Cr: To be confirmed ğŸ« 
[03/07/22, 20:58:37] Kavana N Murthy: Oh fuckğŸ˜‚
[03/07/22, 20:58:45] Pranav Cr: ğŸ¤£ğŸ¤£ğŸ¤£
[03/07/22, 20:58:48] Kavana N Murthy: Unit 2 it's till greedy technique no
[03/07/22, 20:58:54] Kavana N Murthy: I heard from A and D section
[03/07/22, 20:58:58] Pranav Cr: I think that is also there
[03/07/22, 20:59:04] Kavana N Murthy: Oh okay
[03/07/22, 20:59:08] Kavana N Murthy: They said it wasn't there
[03/07/22, 20:59:09] Pranav Cr: I'll ensure with C section once BRS mam takes for them
[03/07/22, 20:59:11] Kavana N Murthy: Haan okies
[03/07/22, 20:59:18] Pranav Cr: ğŸ‘
[05/07/22, 00:31:17] Kavana N Murthy: Can u ask ma'am to send dbms unit 2 notes tomorrow
[05/07/22, 08:04:21] Pranav Cr: She has sent it already
[05/07/22, 09:30:30] Kavana N Murthy: No unit 2
[05/07/22, 09:30:36] Kavana N Murthy: Relational algebra is not there no
[05/07/22, 09:30:47] Pranav Cr: Ayyo that's unit 2 second half
[05/07/22, 09:30:48] Pranav Cr: ğŸ¥²
[05/07/22, 09:30:58] Kavana N Murthy: That's not there?ğŸ˜¬
[05/07/22, 09:31:13] Pranav Cr: I don't think so I'll confirm wait
[05/07/22, 09:31:16] Kavana N Murthy: Haan okies
[05/07/22, 09:31:27] Kavana N Murthy: Tt they will send today only no?ğŸ˜‚ or on Thursday morning
[05/07/22, 09:31:41] Pranav Cr: Yes yesğŸ¤£ğŸ¤£today only
[05/07/22, 23:16:57] Kavana N Murthy: Listen master search there?
[06/07/22, 09:58:52] Pranav Cr: I'll check and tell
[06/07/22, 10:02:31] Pranav Cr: Yes yes it's that time relation thats all
[06/07/22, 10:10:03] Kavana N Murthy: U have any notes or videos for it?
[06/07/22, 10:19:10] Pranav Cr: No actually but sir did it in class
[06/07/22, 10:28:46] Kavana N Murthy: Yeah?
[06/07/22, 10:28:51] Kavana N Murthy: U have written?
[06/07/22, 10:29:15] Pranav Cr: Yeaa it's that time complexity analysis for recursive algo
[06/07/22, 11:02:36] Kavana N Murthy: Oh okay
[08/07/22, 19:09:30] Kavana N Murthy: So what all are there nowğŸ˜‚
[08/07/22, 19:09:34] Kavana N Murthy: It's so confusing
[08/07/22, 19:11:05] Pranav Cr: Everything that is not scratched
[08/07/22, 19:11:07] Pranav Cr: ğŸ¤£
[08/07/22, 19:11:47] Kavana N Murthy: Till subqueries no
[08/07/22, 19:13:14] Pranav Cr: Everything that is not in red
[08/07/22, 19:13:35] Kavana N Murthy: Basically the whole unit?ğŸ˜‚
[08/07/22, 19:13:36] Kavana N Murthy: Wtf
[08/07/22, 19:14:14] Pranav Cr: No no only highlighted things
[08/07/22, 19:16:26] Kavana N Murthy: Thank God
[08/07/22, 19:17:40] Pranav Cr: â€This message was deleted.
[08/07/22, 19:17:50] Pranav Cr: ğŸ«¡
[08/07/22, 20:36:02] Kavana N Murthy: We have ER to relational model?
[08/07/22, 20:51:45] Pranav Cr: yesss
[08/07/22, 20:59:51] Kavana N Murthy: No Cartesian no?
[08/07/22, 21:07:48] Pranav Cr: thats also theree
[10/07/22, 20:59:23] Kavana N Murthy: Can u send
[10/07/22, 20:59:26] Kavana N Murthy: Last class dbms
[10/07/22, 20:59:28] Kavana N Murthy: Observations
[10/07/22, 21:05:39] Pranav Cr: It wasn't there only last lab
[12/07/22, 17:08:46] Kavana N Murthy: We will have holiday?
[12/07/22, 17:09:06] Pranav Cr: Yeah ğŸ˜‚
[12/07/22, 17:09:08] Pranav Cr: Lol
[12/07/22, 17:09:17] Kavana N Murthy: YaayğŸ˜‚
[12/07/22, 17:09:35] Pranav Cr: Vtu fest it is
[12/07/22, 17:09:53] Kavana N Murthy: Peaceful then
[12/07/22, 17:10:23] Pranav Cr: ğŸ¤£
[14/07/22, 21:05:43] Kavana N Murthy: Ada
[14/07/22, 21:05:49] Kavana N Murthy: U wrote?
[14/07/22, 21:45:55] Pranav Cr: Yea
â€[14/07/22, 21:47:25] Pranav Cr: â€<attached: 00001454-PHOTO-2022-07-14-21-47-25.jpg>
â€[14/07/22, 21:47:26] Pranav Cr: â€<attached: 00001455-PHOTO-2022-07-14-21-47-26.jpg>
â€[14/07/22, 21:47:26] Pranav Cr: â€<attached: 00001456-PHOTO-2022-07-14-21-47-26.jpg>
â€[14/07/22, 21:47:26] Pranav Cr: â€<attached: 00001457-PHOTO-2022-07-14-21-47-26.jpg>
â€[14/07/22, 21:47:27] Pranav Cr: â€<attached: 00001458-PHOTO-2022-07-14-21-47-27.jpg>
â€[14/07/22, 21:47:27] Pranav Cr: â€<attached: 00001459-PHOTO-2022-07-14-21-47-27.jpg>
[14/07/22, 21:50:21] Kavana N Murthy: Thank you do u have the code?
[14/07/22, 21:50:31] Pranav Cr: No no copied from a section ğŸ¥²
[14/07/22, 21:50:45] Kavana N Murthy: I hope he doesn't ask TomğŸ˜‚
[14/07/22, 21:51:16] Pranav Cr: If he ask he will ask you onlyğŸ¤£
[14/07/22, 21:51:25] Pranav Cr: Because yogesh sir is our lab teacher
[14/07/22, 21:51:30] Pranav Cr: Harini*
[14/07/22, 21:51:35] Kavana N Murthy: Oh noğŸ˜‚ I'll be like no need attendance also I'll go off
[14/07/22, 21:51:42] Pranav Cr: ğŸ¤£ğŸ¤£ğŸ¤£why
[14/07/22, 21:51:52] Kavana N Murthy: Idk anything in thisğŸ˜‚
[14/07/22, 21:52:14] Pranav Cr: Explain how HSG sir explained that's all
[14/07/22, 21:52:29] Kavana N Murthy: Yeah I'll do that then
[14/07/22, 21:52:52] Pranav Cr: Peaceee
â€[14/07/22, 21:57:05] Kavana N Murthy: â€<attached: 00001472-PHOTO-2022-07-14-21-57-05.jpg>
[14/07/22, 21:57:09] Kavana N Murthy: What is that
[14/07/22, 21:57:36] Pranav Cr: Just plain copy broğŸ¥²
[20/07/22, 10:47:56] Kavana N Murthy: Ur going?
[20/07/22, 10:48:05] Kavana N Murthy: To that seminar?
[03/08/22, 17:17:36] Kavana N Murthy: Send the dbms
[03/08/22, 17:17:39] Kavana N Murthy: Topics no
[03/08/22, 17:17:40] Kavana N Murthy: That sheet
[03/08/22, 17:19:08] Pranav Cr: Yes yes
â€[03/08/22, 17:20:21] Pranav Cr: DBMS Groups (Responses).pdf â€<attached: 00001481-DBMS Groups (Responses).pdf>
[04/08/22, 08:08:23] Kavana N Murthy: Do we have to do graph for bfs DFS?
[04/08/22, 08:08:37] Pranav Cr: Yes yes
[04/08/22, 15:45:15] Kavana N Murthy: Have u done it?
[04/08/22, 17:16:21] Pranav Cr: Ay no bro not yet ğŸ¥²
[06/08/22, 17:08:38] Kavana N Murthy: Tom full online no?
[06/08/22, 17:31:41] Pranav Cr: Yess
[08/08/22, 10:59:29] Kavana N Murthy: What time we have math class?
[08/08/22, 11:03:38] Pranav Cr: 11.15
[09/08/22, 11:10:31] Kavana N Murthy: This dbms
[09/08/22, 11:10:34] Kavana N Murthy: ppt what all u need to put
[09/08/22, 11:10:38] Kavana N Murthy: Can u ask ma'am once
[09/08/22, 11:10:42] Kavana N Murthy: Like how many slides what all
[09/08/22, 11:10:45] Pranav Cr: Yes I'll ask and tell
[09/08/22, 11:10:48] Kavana N Murthy: Haan okies
[09/08/22, 17:06:31] Kavana N Murthy: Dbms is it tomorrow only?
[09/08/22, 17:06:40] Kavana N Murthy: Or like few days from Tom?
[09/08/22, 17:06:43] Pranav Cr: That's what mam told it seems
[09/08/22, 17:06:46] Pranav Cr: .
[09/08/22, 17:06:50] Kavana N Murthy: Ask her once no
[09/08/22, 17:06:56] Kavana N Murthy: If it's only Tom or day after also?
[09/08/22, 17:07:03] Pranav Cr: She told reviews will start from tomorrow
[09/08/22, 17:07:11] Pranav Cr: And she'll pick randomly
[09/08/22, 17:08:44] Kavana N Murthy: should  we do front end?
[09/08/22, 17:08:53] Pranav Cr: Not for tomorrow
[09/08/22, 17:08:55] Pranav Cr: For review 2
[09/08/22, 17:09:08] Kavana N Murthy: just ppt
[09/08/22, 17:09:15] Pranav Cr: Yea
[09/08/22, 17:09:16] Kavana N Murthy: then?
[09/08/22, 17:09:32] Pranav Cr: That's all
[09/08/22, 17:09:54] Kavana N Murthy: Haan okies
[09/08/22, 17:10:02] Kavana N Murthy: And I have this doubt what's this requirement thing
[09/08/22, 17:10:04] Kavana N Murthy: Exactly
[09/08/22, 17:10:07] Kavana N Murthy: Can u give an idea
[09/08/22, 17:10:46] Pranav Cr: Oh requirements are nothing but software apps what you need for your DBMS project
[09/08/22, 17:11:06] Kavana N Murthy: Oh okay then fine
[09/08/22, 19:00:56] Kavana N Murthy: No formals and all no
[09/08/22, 19:01:01] Kavana N Murthy: For math presentation?
[09/08/22, 19:01:10] Pranav Cr: No no nothing like that
[09/08/22, 19:21:24] Kavana N Murthy: Can u check if the table is right
[09/08/22, 19:22:46] Pranav Cr: eveyrthing is correct
[09/08/22, 19:23:09] Pranav Cr: just reverse pariticpants and participates in arrow directiosn
[09/08/22, 19:23:28] Kavana N Murthy: Haan okay
[09/08/22, 19:49:47] Kavana N Murthy: So this table only we need to do no
[09/08/22, 19:50:31] Pranav Cr: Yeahh
[09/08/22, 19:52:05] Kavana N Murthy: Haan okies
[09/08/22, 20:03:09] Kavana N Murthy: This math ppt
[09/08/22, 20:03:14] Kavana N Murthy: Tomorrow only we should show
[09/08/22, 20:03:15] Kavana N Murthy: Code,
[09/08/22, 20:03:16] Kavana N Murthy: ?
[09/08/22, 20:04:33] Pranav Cr: Yes yess
[10/08/22, 19:22:08] Kavana N Murthy: So Ada is on 20th no
[10/08/22, 19:22:12] Kavana N Murthy: Is it like presentation
[10/08/22, 19:22:16] Kavana N Murthy: Or just Google classroom?
[10/08/22, 19:22:31] Pranav Cr: Mm not sure I'll ask mam tomorrow and tell
[10/08/22, 19:22:52] Kavana N Murthy: Haan okay
[11/08/22, 14:22:27] Kavana N Murthy: Bfs DFS Ada u did?
[11/08/22, 17:08:38] Pranav Cr: Ay no bro not yet ğŸ¥²
[11/08/22, 20:27:49] Kavana N Murthy: U wrote now?
[11/08/22, 20:29:09] Pranav Cr: yess
[11/08/22, 20:29:18] Pranav Cr: ill forward from where i wrote wait
[11/08/22, 20:29:23] Pranav Cr: write dif values pls
[11/08/22, 20:29:25] Kavana N Murthy: Haan okies
[11/08/22, 20:29:29] Kavana N Murthy: U have the code?
â€[11/08/22, 20:29:32] Pranav Cr: WhatsApp Unknown 2022-08-11 at 5.52.18 PM.zip â€<attached: 00001547-WhatsApp Unknown 2022-08-11 at 5.52.18 PM.zip>
[11/08/22, 20:29:37] Pranav Cr: yea
[11/08/22, 20:29:41] Kavana N Murthy: Send me no
[11/08/22, 20:29:48] Kavana N Murthy: I'll run and write diff values
[11/08/22, 20:29:51] Pranav Cr: it is in the zip folder
[11/08/22, 20:29:56] Pranav Cr: but i havent tyoed code
[11/08/22, 20:30:19] Kavana N Murthy: Fine fine I'll write it down thank you
[11/08/22, 20:53:19] Kavana N Murthy: First page
[11/08/22, 20:53:23] Kavana N Murthy: Where I should
[11/08/22, 20:53:27] Kavana N Murthy: Initialise v?
[11/08/22, 20:54:21] Pranav Cr: yeahh
[11/08/22, 20:54:22] Pranav Cr: v=1
[11/08/22, 20:55:20] Kavana N Murthy: No like int v
[11/08/22, 20:55:22] Kavana N Murthy: Where should I put
â€[11/08/22, 20:55:36] Kavana N Murthy: â€<attached: 00001561-PHOTO-2022-08-11-20-55-35.jpg>
[11/08/22, 20:56:30] Pranav Cr: even im not sure i will check and tell
[11/08/22, 20:56:33] Pranav Cr: ğŸ¥²ğŸ¥²
[11/08/22, 20:56:39] Kavana N Murthy: Haan okies
[11/08/22, 21:05:36] Kavana N Murthy: U have code blocks?
[11/08/22, 21:06:48] Pranav Cr: NooğŸ¥²
[11/08/22, 21:07:06] Kavana N Murthy: This code is not running in online
[11/08/22, 21:07:07] Kavana N Murthy: ğŸ˜ğŸ˜‚
[11/08/22, 21:07:25] Kavana N Murthy: #include<iostream>
#include<time.h>
#include<windows.h>
#include<unistd.h>
using namespace std;
int a[10000][10000],reach[10000],n;
void dfs(int n)
{
    int i;
    int v;
    reach[v]=1;
    for(int i=1;i<=n;i++)
    if(a[v][i] && !reach[i])
    {
        Sleep(1);
        cout<<"\n"<<v<<"->"<<i;
        dfs(i);
    }
}
int main()
{
int i,j,count=0;
cout<<"Enter the no of vertices\n";
cin>>n;
for(int i=1;i<=n;i++)
{
    reach[i]=0;
